web-scraper-order,web-scraper-start-url,name,location,bedroom,bathroom,garage,land_area,building_area,price
1716900326-1120,https://www.rumah123.com/jual/jakarta-pusat/rumah/?sort=posted-desc&page=995,Rumah Kost ROI Tinggi Pangeran Jayakarta Jakarta Barat,"Pangeran Jayakarta, Jakarta Pusat",27,27,,148 m²,658 m²,"Rp 6,9 Miliar"
1716900341-1121,https://www.rumah123.com/jual/jakarta-pusat/rumah/?sort=posted-desc&page=994,Rumah Mewah Mediterania Style di Menteng Jakarta Pusat,"Menteng, Jakarta Pusat",7,7,2,925 m²,1390 m²,Rp 70 Miliar
1716900341-1122,https://www.rumah123.com/jual/jakarta-pusat/rumah/?sort=posted-desc&page=994,(Sale)  Rumah Exclusive Di Area Menteng,"Menteng, Jakarta Pusat",4,4,2,470 m²,600 m²,Rp 35 Miliar
1716900341-1123,https://www.rumah123.com/jual/jakarta-pusat/rumah/?sort=posted-desc&page=994,Rumah di Pejompongan,"Pejompongan, Jakarta Pusat",6,6,,312 m²,300 m²,Rp 17 Miliar
1716900341-1124,https://www.rumah123.com/jual/jakarta-pusat/rumah/?sort=posted-desc&page=994,Rumah 3 lantai  bangunan kokoh dan terawat cempaka putih jakarta pusat,"Cempaka Putih, Jakarta Pusat",6,7,1,800 m²,600 m²,Rp 23 Miliar
1716900341-1125,https://www.rumah123.com/jual/jakarta-pusat/rumah/?sort=posted-desc&page=994,Dijual Rumah Butuh Renovasi Didaerah Taman Solo Cempaka Putih Jakarta Pusat,"Cempaka Putih, Jakarta Pusat",6,3,1,280 m²,305 m²,"Rp 6,5 Miliar"
1716900341-1126,https://www.rumah123.com/jual/jakarta-pusat/rumah/?sort=posted-desc&page=994,Rumah di Senayan,"Senayan, Jakarta Pusat",3,4,2,274 m²,300 m²,Rp 14 Miliar
1716900341-1127,https://www.rumah123.com/jual/jakarta-pusat/rumah/?sort=posted-desc&page=994,Runah di Patal Senayan,"Senayan, Jakarta Pusat",4,3,1,294 m²,350 m²,Rp 23 Miliar
1716900341-1128,https://www.rumah123.com/jual/jakarta-pusat/rumah/?sort=posted-desc&page=994,Rumah Menteng Jaya strategis sangat cocok buat kontrakan dan kost,"Menteng, Jakarta Pusat",9,5,,352 m²,300 m²,"Rp 2,5 Miliar"
1716900341-1129,https://www.rumah123.com/jual/jakarta-pusat/rumah/?sort=posted-desc&page=994,JUAL CEPAT MURAH RUMAH STRATEGIS GUNUNG SAHARI,"Gunung Sahari, Jakarta Pusat",4,3,,123 m²,144 m²,"Rp 1,6 Miliar"
1716900341-1130,https://www.rumah123.com/jual/jakarta-pusat/rumah/?sort=posted-desc&page=994,"RUMAH PATI, MENTENG LOKASI STRATEGIS, LINGKUNGAN TENANG, AMAN DAN COCOK UNTUK HUNIAN.","Menteng, Jakarta Pusat",,,,200 m²,,Rp 7 Miliar
1716900341-1131,https://www.rumah123.com/jual/jakarta-pusat/rumah/?sort=posted-desc&page=994,cepat rumah di menteng siap huni Charlie 081280000566,"Menteng, Jakarta Pusat",4,3,2,150 m²,220 m²,Rp 8 Miliar
1716900341-1132,https://www.rumah123.com/jual/jakarta-pusat/rumah/?sort=posted-desc&page=994,"Petojo Selatan, Rumah Baru Siap Huni 3,5 Lantai, Disain Istimewa","Cideng, Jakarta Pusat",4,4,1,120 m²,321 m²,"Rp 4,7 Miliar"
1716900341-1133,https://www.rumah123.com/jual/jakarta-pusat/rumah/?sort=posted-desc&page=994,"Keadilan, Glodok Rumah Lama 148 m2 Mau Jual Cepat Murah","Gajah Mada, Jakarta Pusat",3,2,,148 m²,144 m²,"Rp 3,1 Miliar"
1716900341-1134,https://www.rumah123.com/jual/jakarta-pusat/rumah/?sort=posted-desc&page=994,"Rumah Hoek Di Jl. Nilam II, Kemayoran. Lokasi Strategis, Cocok Untuk Hunian/kost2an.","Kemayoran, Jakarta Pusat",6,6,,666 m²,600 m²,"Rp 8,95 Miliar"
1716900341-1135,https://www.rumah123.com/jual/jakarta-pusat/rumah/?sort=posted-desc&page=994,"Rumah Mewah di Jl. Intan Raya, Kemayoran. Lokasi Asri dan Strategis. Cocok Untuk Hunian.","Kemayoran, Jakarta Pusat",6,6,2,549 m²,600 m²,"Rp 7,4 Miliar"
1716900341-1136,https://www.rumah123.com/jual/jakarta-pusat/rumah/?sort=posted-desc&page=994,"Rumah Kost | ROI Tinggi Pangeran Jayakarta, Jakarta Barat","Pangeran Jayakarta, Jakarta Pusat",27,27,,148 m²,658 m²,"Rp 6,9 Miliar"
1716900341-1137,https://www.rumah123.com/jual/jakarta-pusat/rumah/?sort=posted-desc&page=994,Rumah 2 Lantai Asri Tenang Dan Ada Pool di Menteng Jakarta Pusat,"Menteng, Jakarta Pusat",4,4,2,285 m²,400 m²,Rp 27 Miliar
1716900341-1138,https://www.rumah123.com/jual/jakarta-pusat/rumah/?sort=posted-desc&page=994,Rumah 2 Lantai Lingkungan Tenang di Menteng Jakarta Pusat,"Menteng, Jakarta Pusat",5,3,3,723 m²,289 m²,Rp 45 Miliar
1716900341-1139,https://www.rumah123.com/jual/jakarta-pusat/rumah/?sort=posted-desc&page=994,Menteng rumah lama 2 lantai kokoh layak huni S.pool,"Menteng, Jakarta Pusat",4,4,2,669 m²,500 m²,Rp 50 Miliar
1716900341-1140,https://www.rumah123.com/jual/jakarta-pusat/rumah/?sort=posted-desc&page=994,Rumah Lokasi Nyaman Menteng Pegangsaan,"Menteng, Jakarta Pusat",3,3,6,380 m²,250 m²,Rp 20 Miliar
1716900369-1141,https://www.rumah123.com/jual/jakarta-pusat/rumah/?sort=posted-desc&page=993,"Rumah Tua dilokasi Strategis dan Asri. Sangat Cocok Untuk Hunian/kost2an. Lokasi Di Jl. Rembiga, Gunung Sahari.","Sawah Besar, Jakarta Pusat",5,5,1,236 m²,200 m²,"Rp 4,65 Miliar"
1716900369-1142,https://www.rumah123.com/jual/jakarta-pusat/rumah/?sort=posted-desc&page=993,Rumah 3 Lantai Minimalis Modern Dan Baru di Menteng Jakarta Pusat,"Menteng, Jakarta Pusat",3,3,2,235 m²,520 m²,Rp 21 Miliar
1716900369-1143,https://www.rumah123.com/jual/jakarta-pusat/rumah/?sort=posted-desc&page=993,HARUS TERJUAL Rumah Golf Residences Kemayoran hadap Golf,"Kemayoran, Jakarta Pusat",5,4,1,200 m²,350 m²,Rp 11 Miliar
1716900369-1144,https://www.rumah123.com/jual/jakarta-pusat/rumah/?sort=posted-desc&page=993,RUMAH MURAH JL BONANG MENTENG JAKARTA PUSAT,"Menteng, Jakarta Pusat",4,4,2,609 m²,1092 m²,Rp 22 Miliar
1716900369-1145,https://www.rumah123.com/jual/jakarta-pusat/rumah/?sort=posted-desc&page=993,RUMAH MURAH HITUNG TANAH MENTENG JAKARTA PUSAT,"Menteng, Jakarta Pusat",1,1,1,726 m²,500 m²,"Rp 36,5 Miliar"
1716900369-1146,https://www.rumah123.com/jual/jakarta-pusat/rumah/?sort=posted-desc&page=993,HARUS TERJUAL Rumah Golf Residences Kemayoran hadap Golf,"Kemayoran, Jakarta Pusat",5,4,1,200 m²,350 m²,"Rp 10,5 Miliar"
1716900369-1147,https://www.rumah123.com/jual/jakarta-pusat/rumah/?sort=posted-desc&page=993,"Rumah Gunung Sahari, Jakpus","Gunung Sahari, Jakarta Pusat",4,2,2,215 m²,320 m²,"Rp 4,9 Miliar"
1716900369-1148,https://www.rumah123.com/jual/jakarta-pusat/rumah/?sort=posted-desc&page=993,"Dijual Rumah Baru lokasi strategis dipusat jakarta ""2Bes""","Bendungan Hilir, Jakarta Pusat",3,3,,201 m²,301 m²,Rp 9 Miliar
1716900369-1149,https://www.rumah123.com/jual/jakarta-pusat/rumah/?sort=posted-desc&page=993,Rumah Townhouse Cempaka Putih Timur Jakarta Pusat,"Cempaka Putih, Jakarta Pusat",2,2,,41 m²,71 m²,"Rp 1,63 Miliar"
1716900369-1150,https://www.rumah123.com/jual/jakarta-pusat/rumah/?sort=posted-desc&page=993,Dijual Rumah Bersejarah Hitung Tanah Daerah Senen Jakarta Pusat,"Kramat, Jakarta Pusat",5,2,2,208 m²,192 m²,"Rp 2,68 Miliar"
1716900369-1151,https://www.rumah123.com/jual/jakarta-pusat/rumah/?sort=posted-desc&page=993,JP102 Sold Rumah Di Tanjung Luxury Dengan Rooftop View Pusat Kota,"Menteng, Jakarta Pusat",5,5,,424 m²,1000 m²,"Rp 49,5 Miliar"
1716900369-1152,https://www.rumah123.com/jual/jakarta-pusat/rumah/?sort=posted-desc&page=993,"BU...BU...TURUN HARGA...RUMAH LAMA DI CIDENG, JAKARTA PUSAT, LOKASI BAGUS, HITUNG TANAH","Cideng, Jakarta Pusat",4,2,,276 m²,200 m²,"Rp 10,5 Miliar"
1716900369-1153,https://www.rumah123.com/jual/jakarta-pusat/rumah/?sort=posted-desc&page=993,Rumah Menteng Strategis dekat Sudirman,"Menteng, Jakarta Pusat",30,30,8,860 m²,1000 m²,Rp 60 Miliar
1716900369-1154,https://www.rumah123.com/jual/jakarta-pusat/rumah/?sort=posted-desc&page=993,"Rumah baru gress 2 lantai di Kebon Jahe, Petojo dekat Tanah Abang, Jakarta Pusat","Tanah Abang, Jakarta Pusat",3,2,1,148 m²,150 m²,"Rp 4,5 Miliar"
1716900369-1155,https://www.rumah123.com/jual/jakarta-pusat/rumah/?sort=posted-desc&page=993,"Rumah Kost 105 kamar tidur di Senen, Jakarta Pusat","Senen, Jakarta Pusat",99,89,,774 m²,1553 m²,"Rp 19,5 Miliar"
1716900369-1156,https://www.rumah123.com/jual/jakarta-pusat/rumah/?sort=posted-desc&page=993,"RUMAH BAGUS SIAP HUNI DI CIDENG, JAKARTA PUSAT","Cideng, Jakarta Pusat",3,3,1,128 m²,250 m²,"Rp 4,2 Miliar"
1716900369-1157,https://www.rumah123.com/jual/jakarta-pusat/rumah/?sort=posted-desc&page=993,Rumah Kost Kwitang Senen Lokasi Mudah Diakses,"Senen, Jakarta Pusat",30,8,1,171 m²,220 m²,"Rp 4,5 Miliar"
1716900369-1158,https://www.rumah123.com/jual/jakarta-pusat/rumah/?sort=posted-desc&page=993,Rumah Kost Kwitang Senen Jakarta Pusat Harga Dibawah Pbb,"Senen, Jakarta Pusat",32,8,,399 m²,650 m²,"Rp 5,5 Miliar"
1716900369-1159,https://www.rumah123.com/jual/jakarta-pusat/rumah/?sort=posted-desc&page=993,Rumah model lama di Menteng Jakpus,"Menteng, Jakarta Pusat",5,3,1,743 m²,500 m²,Rp 95 Miliar
1716900369-1160,https://www.rumah123.com/jual/jakarta-pusat/rumah/?sort=posted-desc&page=993,Rumah luxury swimming pool  menteng,"Menteng, Jakarta Pusat",7,7,2,925 m²,1390 m²,Rp 70 Miliar
1716900389-1161,https://www.rumah123.com/jual/jakarta-pusat/rumah/?sort=posted-desc&page=992,"RUMAH TUA di Abdul Muis, Tanah Abang  KOMERSIL UTK KANTOR DI JAKARTA PUSAT","Tanah Abang, Jakarta Pusat",3,2,2,598 m²,420 m²,Rp 25 Miliar
1716900389-1162,https://www.rumah123.com/jual/jakarta-pusat/rumah/?sort=posted-desc&page=992,Rumah Bagus Di Ring 1 Menteng,"Menteng, Jakarta Pusat",5,6,12,2629 m²,1750 m²,Rp 350 Miliar
1716900389-1163,https://www.rumah123.com/jual/jakarta-pusat/rumah/?sort=posted-desc&page=992,Rumah  Jl. Sukadana Cideng Belakang Roxy mas,"Cideng, Jakarta Pusat",5,2,,407 m²,200 m²,Rp 11 Miliar
1716900389-1164,https://www.rumah123.com/jual/jakarta-pusat/rumah/?sort=posted-desc&page=992,RUMAH KRAMAT MINIMALIS SIAP HUNI,"Kramat, Jakarta Pusat",4,3,2,148 m²,128 m²,"Rp 4,5 Miliar"
1716900389-1165,https://www.rumah123.com/jual/jakarta-pusat/rumah/?sort=posted-desc&page=992,(SALE) Rumah PAM Baru di Pejompongan.,"Pejompongan, Jakarta Pusat",5,5,2,304 m²,300 m²,Rp 9 Miliar
1716900389-1166,https://www.rumah123.com/jual/jakarta-pusat/rumah/?sort=posted-desc&page=992,(Sale) Rumah Daerah menteng Cocok Dijadikan Kantor.,"Menteng, Jakarta Pusat",1,1,,400 m²,600 m²,Rp 45 Miliar
1716900389-1167,https://www.rumah123.com/jual/jakarta-pusat/rumah/?sort=posted-desc&page=992,"Rumah Mewah, Lokasi Strategis @Pejompongan","Pejompongan, Jakarta Pusat",8,4,1,520 m²,650 m²,Rp 18 Miliar
1716900389-1168,https://www.rumah123.com/jual/jakarta-pusat/rumah/?sort=posted-desc&page=992,Dijual Rumah Kemayoran Jakarta Pusat Rp 3.1 M Nego,"Kemayoran, Jakarta Pusat",3,3,,142 m²,237 m²,"Rp 3,1 Miliar"
1716900389-1169,https://www.rumah123.com/jual/jakarta-pusat/rumah/?sort=posted-desc&page=992,"Rumah cocok bangun kantor di Menteng, Jakarta pusat","Menteng, Jakarta Pusat",6,2,2,646 m²,455 m²,Rp 28 Miliar
1716900389-1170,https://www.rumah123.com/jual/jakarta-pusat/rumah/?sort=posted-desc&page=992,"Rumah new brand ter Lux Fullniest dan kolam renang di Menteng, Jakarta pusat","Menteng, Jakarta Pusat",5,5,2,474 m²,1400 m²,Rp 69 Miliar
1716900389-1171,https://www.rumah123.com/jual/jakarta-pusat/rumah/?sort=posted-desc&page=992,Dijual Rumah Kost- Kost di Benhil,"Tanah Abang, Jakarta Pusat",12,9,2,160 m²,112 m²,"Rp 8,5 Miliar"
1716900389-1172,https://www.rumah123.com/jual/jakarta-pusat/rumah/?sort=posted-desc&page=992,"Rumah Dijual di Benhi, Jakarta Pusat","Tanah Abang, Jakarta Pusat",9,3,1,120 m²,90 m²,"Rp 5,8 Miliar"
1716900389-1173,https://www.rumah123.com/jual/jakarta-pusat/rumah/?sort=posted-desc&page=992,Menteng Area,"Menteng, Jakarta Pusat",,,,400 m²,,Rp 35 Miliar
1716900389-1174,https://www.rumah123.com/jual/jakarta-pusat/rumah/?sort=posted-desc&page=992,Rumah dengan Tanah Kotak Di Indramayu Menteng  Segera Charlie 081280000566,"Menteng, Jakarta Pusat",4,4,4,700 m²,450 m²,Rp 59 Miliar
1716900389-1175,https://www.rumah123.com/jual/jakarta-pusat/rumah/?sort=posted-desc&page=992,Rumah Murah hitung Tanah di Daerah Elite Golongan C Siap Pakai,"Menteng, Jakarta Pusat",5,5,4,721 m²,900 m²,Rp 68 Miliar
1716900389-1176,https://www.rumah123.com/jual/jakarta-pusat/rumah/?sort=posted-desc&page=992,Rumah Pejompongan,"Pejompongan, Jakarta Pusat",6,6,,312 m²,300 m²,Rp 17 Miliar
1716900389-1177,https://www.rumah123.com/jual/jakarta-pusat/rumah/?sort=posted-desc&page=992,Dijual Rumah Strategis Penjernihan Furnished Rp. 19 M,"Tanah Abang, Jakarta Pusat",8,5,1,520 m²,650 m²,Rp 19 Miliar
1716900389-1178,https://www.rumah123.com/jual/jakarta-pusat/rumah/?sort=posted-desc&page=992,"Rumah Hoek Strategis di Jl. Bacan, Cideng, Gambir. Sangat Cocok Untuk Hunian/kost2an.","Gambir, Jakarta Pusat",5,5,1,175 m²,250 m²,"Rp 3,85 Miliar"
1716900389-1179,https://www.rumah123.com/jual/jakarta-pusat/rumah/?sort=posted-desc&page=992,"Rumah Bagus 2 Lantai, Strategis, Cocok Untuk Hunian. Lokasi di Jl. Kembang IV, Senen.","Senen, Jakarta Pusat",5,5,1,235 m²,300 m²,"Rp 2,45 Miliar"
1716900389-1180,https://www.rumah123.com/jual/jakarta-pusat/rumah/?sort=posted-desc&page=992,Rumah strategis di pusat kota Jakarta,"Gambir, Jakarta Pusat",8,4,1,274 m²,125 m²,Rp 15 Miliar
1716900407-1181,https://www.rumah123.com/jual/jakarta-pusat/rumah/?sort=posted-desc&page=991,Dijual Rumah Baru jl Batu Tulis,"Batutulis, Jakarta Pusat",4,2,,48 m²,90 m²,"Rp 1,65 Miliar"
1716900407-1182,https://www.rumah123.com/jual/jakarta-pusat/rumah/?sort=posted-desc&page=991,Pejompongan Rumah Dalam Komplek Dekat Perkantoran Jakarta Pusat,"Pejompongan, Jakarta Pusat",3,2,1,135 m²,150 m²,Rp 8 Miliar
1716900407-1183,https://www.rumah123.com/jual/jakarta-pusat/rumah/?sort=posted-desc&page=991,Apartemen Kempinski Private Residence,"Thamrin, Jakarta Pusat",2,2,1,123 m²,,Rp 6 Miliar
1716900407-1184,https://www.rumah123.com/jual/jakarta-pusat/rumah/?sort=posted-desc&page=991,Rumah Dan Lokasi Pertiuse,"Menteng, Jakarta Pusat",5,5,12,2600 m²,1700 m²,Rp 420 Miliar
1716900407-1185,https://www.rumah123.com/jual/jakarta-pusat/rumah/?sort=posted-desc&page=991,"RUMAH PETOJO, BAGUS DAN SIAP PAKAI, LOKASI SANGAT STRATEGIS DI PUSAT KOTA","Petojo, Jakarta Pusat",5,3,,170 m²,256 m²,"Rp 6,5 Miliar"
1716900407-1186,https://www.rumah123.com/jual/jakarta-pusat/rumah/?sort=posted-desc&page=991,"RUMAH PETOJO, BAGUS DAN SIAP PAKAI, LOKASI SANGAT STRATEGIS DI PUSAT KOTA","Petojo, Jakarta Pusat",5,3,,170 m²,256 m²,"Rp 6,5 Miliar"
1716900407-1187,https://www.rumah123.com/jual/jakarta-pusat/rumah/?sort=posted-desc&page=991,"Rumah Tua Super Murah di Cempaka Putih Tengah, Jakarta Pusat","Cempaka Putih, Jakarta Pusat",2,1,2,398 m²,200 m²,"Rp 6,5 Miliar"
1716900407-1188,https://www.rumah123.com/jual/jakarta-pusat/rumah/?sort=posted-desc&page=991,Rumah Mewah di Menteng,"Menteng, Jakarta Pusat",5,5,12,2629 m²,1724 m²,Rp 400 Miliar
1716900407-1189,https://www.rumah123.com/jual/jakarta-pusat/rumah/?sort=posted-desc&page=991,Menteng Rumah Tua Hitung Tanah Boulevard 60M,"Menteng, Jakarta Pusat",5,3,4,692 m²,350 m²,Rp 60 Miliar
1716900407-1190,https://www.rumah123.com/jual/jakarta-pusat/rumah/?sort=posted-desc&page=991,Rumah Tua Hitung Tanah Kawasan Boulevard Menteng 60M,"Menteng, Jakarta Pusat",5,3,,692 m²,350 m²,Rp 60 Miliar
1716900407-1191,https://www.rumah123.com/jual/jakarta-pusat/rumah/?sort=posted-desc&page=991,Rumah mewah siap huni lokasi menteng,"Menteng, Jakarta Pusat",6,6,2,596 m²,750 m²,Rp 38 Miliar
1716900407-1192,https://www.rumah123.com/jual/jakarta-pusat/rumah/?sort=posted-desc&page=991,"Rumah Lama HITUNG TANAH Prime Area JL. Teuku Umar, Menteng","Menteng, Jakarta Pusat",1,1,2,700 m²,400 m²,Rp 77 Miliar
1716900407-1193,https://www.rumah123.com/jual/jakarta-pusat/rumah/?sort=posted-desc&page=991,"Rumah Prime Area Ring 1 Jl. TEUKU UMAR, Menteng, Jakarta Pusat","Menteng, Jakarta Pusat",5,5,8,2629 m²,1724 m²,Rp 325 Miliar
1716900407-1194,https://www.rumah123.com/jual/jakarta-pusat/rumah/?sort=posted-desc&page=991,Rumah Kost Mewah dan  Instagramable di Senen Jakpus,"Senen, Jakarta Pusat",106,51,,774 m²,2053 m²,Rp 25 Miliar
1716900407-1195,https://www.rumah123.com/jual/jakarta-pusat/rumah/?sort=posted-desc&page=991,MENTENG.RUMAH DENGAN HALAMAN LUAS.DI RING 1 MENTENG JAKARTA PUSAT,"Menteng, Jakarta Pusat",5,5,12,2697 m²,1724 m²,Rp 350 Miliar
1716900407-1196,https://www.rumah123.com/jual/jakarta-pusat/rumah/?sort=posted-desc&page=991,RESIDENCE/ RUMAH KOST EKLUSIF di Menteng Jakarta Pusat,"Menteng, Jakarta Pusat",19,,,294 m²,500 m²,"Rp 16,5 Miliar"
1716900407-1197,https://www.rumah123.com/jual/jakarta-pusat/rumah/?sort=posted-desc&page=991,"Rumah di Jl. Kebon Kosong, Kemayoran. Cocok Untuk Hunian.","Kemayoran, Jakarta Pusat",5,5,,563 m²,400 m²,Rp 5 Miliar
1716900407-1198,https://www.rumah123.com/jual/jakarta-pusat/rumah/?sort=posted-desc&page=991,"Rumah Mewah 3 Lantai, di Jl. Kebon Jahe, Petojo, Gambir. Lokasi Strategis, Sangat Cocok Untu Hunian.","Gambir, Jakarta Pusat",5,5,1,235 m²,400 m²,"Rp 8,1 Miliar"
1716900407-1199,https://www.rumah123.com/jual/jakarta-pusat/rumah/?sort=posted-desc&page=991,"Rumah Cluster Kembang Kwitang, Siap Huni!","Senen, Jakarta Pusat",30,2,,34 m²,63 m²,Rp 900 Juta
1716900407-1200,https://www.rumah123.com/jual/jakarta-pusat/rumah/?sort=posted-desc&page=991,"Rumah Di Roxy, Petojo, Jakarta Pusat","Roxy, Jakarta Pusat",4,2,1,166 m²,102 m²,"Rp 4,3 Miliar"
1716900424-1201,https://www.rumah123.com/jual/jakarta-pusat/rumah/?sort=posted-desc&page=990,Menteng Area,"Menteng, Jakarta Pusat",4,4,,215 m²,250 m²,Rp 27 Miliar
1716900424-1202,https://www.rumah123.com/jual/jakarta-pusat/rumah/?sort=posted-desc&page=990,"RUMAH MEWAH DI CIDENG, SANGAT BAGUS, DIJAMIN NYAMAN!","Cideng, Jakarta Pusat",7,4,,420 m²,650 m²,"Rp 17,5 Miliar"
1716900424-1203,https://www.rumah123.com/jual/jakarta-pusat/rumah/?sort=posted-desc&page=990,"RUMAH MEWAH DI CIDENG, SANGAT BAGUS, DIJAMIN NYAMAN!","Cideng, Jakarta Pusat",7,4,,420 m²,650 m²,Rp 17 Miliar
1716900424-1204,https://www.rumah123.com/jual/jakarta-pusat/rumah/?sort=posted-desc&page=990,"RUMAH MEWAH DI CIDENG, SANGAT BAGUS, DIJAMIN NYAMAN!","Cideng, Jakarta Pusat",7,4,,420 m²,650 m²,Rp 17 Miliar
1716900424-1205,https://www.rumah123.com/jual/jakarta-pusat/rumah/?sort=posted-desc&page=990,"Rumah besar kokoh permanen strategis 'niaga,di jual murah, d jl.Tanah tinggi.Senen,L.Tanah:148 (11x16)m2,L.Bangunn:300m2,terdiri:3 lantai,km.Tidur:6,km.Mandi:4,garasi:2 mbl, harga murah banget hanya: 2,6M,segera hubungi: 0821.1838.9158 Linawati(linaliu)","Senen, Jakarta Pusat",6,4,2,148 m²,300 m²,"Rp 2,5 Miliar"
1716900424-1206,https://www.rumah123.com/jual/jakarta-pusat/rumah/?sort=posted-desc&page=990,TERMURAH RUMAH KOS KOSAN SENEN JAKARTA PUSAT KAMAR TIDUR 106 SUDAH TERISI KAMAR MANDI 51 SIAP HUNI LOKASI STRATEGIS,"Senen, Jakarta Pusat",51,51,20,774 m²,2053 m²,Rp 18 Miliar
1716900424-1207,https://www.rumah123.com/jual/jakarta-pusat/rumah/?sort=posted-desc&page=990,Sale Jual Cepat Rumah Menteng di Jantung Pusat Kota Me001,"Menteng, Jakarta Pusat",4,4,15,1500 m²,1500 m²,Rp 300 Miliar
1716900424-1208,https://www.rumah123.com/jual/jakarta-pusat/rumah/?sort=posted-desc&page=990,"Rumah Hoki, Ngantong, Jalan Raya Paseban, Senen dekat Hotel OYO  Luas 206m2","Senen, Jakarta Pusat",2,2,,206 m²,,"Rp 5,9 Miliar"
1716900424-1209,https://www.rumah123.com/jual/jakarta-pusat/rumah/?sort=posted-desc&page=990,Rumah Cempaka Putih Bagus Minimalis Modern,"Cempaka Putih, Jakarta Pusat",4,3,,145 m²,260 m²,"Rp 3,75 Miliar"
1716900424-1210,https://www.rumah123.com/jual/jakarta-pusat/rumah/?sort=posted-desc&page=990,Rumah Modern Kontemporer Area Menteng,"Menteng, Jakarta Pusat",4,5,2,450 m²,1000 m²,Rp 45 Miliar
1716900424-1211,https://www.rumah123.com/jual/jakarta-pusat/rumah/?sort=posted-desc&page=990,rumah percetakan negara jakarta pusat,"Percetakan Negara, Jakarta Pusat",3,3,,138 m²,114 m²,"Rp 4,8 Miliar"
1716900424-1212,https://www.rumah123.com/jual/jakarta-pusat/rumah/?sort=posted-desc&page=990,Rumah Bagus Hitung Tanah,"Percetakan Negara, Jakarta Pusat",6,6,3,396 m²,300 m²,"Rp 8,2 Miliar"
1716900424-1213,https://www.rumah123.com/jual/jakarta-pusat/rumah/?sort=posted-desc&page=990,"Rumah Lama di Jl Johar, Kebon Sirih, Jakarta Pusat.. Untuk informasi hub: 0813-1838-1838.","Menteng, Jakarta Pusat",4,3,1,1075 m²,700 m²,Rp 69 Miliar
1716900424-1214,https://www.rumah123.com/jual/jakarta-pusat/rumah/?sort=posted-desc&page=990,Rumah Mewah Jl. Pasuruan Menteng Jakarta Pusat,"Menteng, Jakarta Pusat",5,4,,655 m²,550 m²,Rp 46 Miliar
1716900424-1215,https://www.rumah123.com/jual/jakarta-pusat/rumah/?sort=posted-desc&page=990,Rumah lokasi strategis,"Menteng, Jakarta Pusat",6,6,2,735 m²,503 m²,Rp 50 Miliar
1716900424-1216,https://www.rumah123.com/jual/jakarta-pusat/rumah/?sort=posted-desc&page=990,Dijual Ring 1 Nya Menteng ( Teuku Umar),"Menteng, Jakarta Pusat",5,5,12,2629 m²,1724 m²,Rp 400 Miliar
1716900424-1217,https://www.rumah123.com/jual/jakarta-pusat/rumah/?sort=posted-desc&page=990,"Rumah Tua di Pejompongan, Jakarta Pusat","Pejompongan, Jakarta Pusat",4,3,1,252 m²,103 m²,"Rp 7,3 Miliar"
1716900424-1218,https://www.rumah123.com/jual/jakarta-pusat/rumah/?sort=posted-desc&page=990,"Rumah Bagus Siap Huni, Harga Termurah Dibawah NJOP!! di Batu Ceper, Jakarta Pusat","Batu Ceper, Jakarta Pusat",5,2,2,235 m²,400 m²,"Rp 4,5 Miliar"
1716900424-1219,https://www.rumah123.com/jual/jakarta-pusat/rumah/?sort=posted-desc&page=990,"RUMAH KOST MEWAH, SENEN, JAKARTA  PUSAT","Senen, Jakarta Pusat",106,51,,774 m²,1553 m²,Rp 25 Miliar
1716900424-1220,https://www.rumah123.com/jual/jakarta-pusat/rumah/?sort=posted-desc&page=990,Rumah Tua di Kramat Senen Jakarta Pusat,"Senen, Jakarta Pusat",2,2,,550 m²,550 m²,Rp 14 Miliar
1716900440-1221,https://www.rumah123.com/jual/jakarta-pusat/rumah/?sort=posted-desc&page=989,(SALE) Rumah Siap Huni Ring 1 Menteng Jakarta Pusat,"Menteng, Jakarta Pusat",,,,750 m²,,Rp 73 Miliar
1716900440-1222,https://www.rumah123.com/jual/jakarta-pusat/rumah/?sort=posted-desc&page=989,Dijual Rumah di benhill,"Bendungan Hilir, Jakarta Pusat",2,3,1,150 m²,70 m²,"Rp 7,5 Miliar"
1716900440-1223,https://www.rumah123.com/jual/jakarta-pusat/rumah/?sort=posted-desc&page=989,"Runah Tua Hitung Tanah, Menteng, Jakarta Pusat","Menteng, Jakarta Pusat",8,4,3,441 m²,400 m²,Rp 35 Miliar
1716900440-1224,https://www.rumah123.com/jual/jakarta-pusat/rumah/?sort=posted-desc&page=989,"Dijual Rumah bagus di Menteng, Turun harga terus, BU banget","Menteng, Jakarta Pusat",5,2,2,290 m²,400 m²,Rp 11 Miliar
1716900440-1225,https://www.rumah123.com/jual/jakarta-pusat/rumah/?sort=posted-desc&page=989,MENTENG AREA,"Menteng, Jakarta Pusat",4,3,,595 m²,400 m²,Rp 45 Miliar
1716900440-1226,https://www.rumah123.com/jual/jakarta-pusat/rumah/?sort=posted-desc&page=989,"Dijual Rumah Menteng Baru Selesai Renovasi Siap Huni,2 Lantai,shm","Menteng, Jakarta Pusat",7,7,6,821 m²,1400 m²,Rp 55 Miliar
1716900440-1227,https://www.rumah123.com/jual/jakarta-pusat/rumah/?sort=posted-desc&page=989,sale Rumah di Menteng Pinggir Jalan Raya Utama Me001,"Menteng, Jakarta Pusat",11,5,8,611 m²,700 m²,Rp 55 Miliar
1716900440-1228,https://www.rumah123.com/jual/jakarta-pusat/rumah/?sort=posted-desc&page=989,Rumah Mewah Di Kawasan Elit Menteng Jakarta Pusat,"Menteng, Jakarta Pusat",6,6,2,733 m²,1100 m²,Rp 52 Miliar
1716900440-1229,https://www.rumah123.com/jual/jakarta-pusat/rumah/?sort=posted-desc&page=989,sale Rumah Bagus Dilokasi Strategis Siap Huni Menteng Jakarta Pusat,"Menteng, Jakarta Pusat",6,4,5,470 m²,600 m²,Rp 45 Miliar
1716900440-1230,https://www.rumah123.com/jual/jakarta-pusat/rumah/?sort=posted-desc&page=989,(SALE) Rumah Luxury Elegant Mewah Siap Huni Menteng,"Menteng, Jakarta Pusat",4,4,2,1100 m²,1000 m²,Rp 120 Miliar
1716900440-1231,https://www.rumah123.com/jual/jakarta-pusat/rumah/?sort=posted-desc&page=989,CB130 Rumah Di Pinggir Jalan Di Area Prime Menteng,"Menteng, Jakarta Pusat",5,3,2,970 m²,550 m²,Rp 82 Miliar
1716900440-1232,https://www.rumah123.com/jual/jakarta-pusat/rumah/?sort=posted-desc&page=989,Rumah di jalan kramat murah 2 lantai model ruko hak milik dengan akses jalan 2 mobil,"Kramat, Jakarta Pusat",3,2,1,36 m²,71 m²,Rp 750 Juta
1716900440-1233,https://www.rumah123.com/jual/jakarta-pusat/rumah/?sort=posted-desc&page=989,Rumah Mewah di jual di Menteng full renovasi siap huni,"Menteng, Jakarta Pusat",7,7,4,821 m²,1400 m²,Rp 55 Miliar
1716900440-1234,https://www.rumah123.com/jual/jakarta-pusat/rumah/?sort=posted-desc&page=989,Rumah murah dmenteng wadas,"Menteng, Jakarta Pusat",5,5,1,514 m²,250 m²,"Rp 9,5 Miliar"
1716900440-1235,https://www.rumah123.com/jual/jakarta-pusat/rumah/?sort=posted-desc&page=989,"RUMAH TUA JARANG DIJUAL DI CIDENG, LOKASI BAGUS! !","Cideng, Jakarta Pusat",4,3,,450 m²,450 m²,Rp 18 Miliar
1716900440-1236,https://www.rumah123.com/jual/jakarta-pusat/rumah/?sort=posted-desc&page=989,"RUMAH TUA JARANG DIJUAL DI CIDENG, LOKASI BAGUS! !","Cideng, Jakarta Pusat",4,3,,450 m²,450 m²,Rp 18 Miliar
1716900440-1237,https://www.rumah123.com/jual/jakarta-pusat/rumah/?sort=posted-desc&page=989,"RUMAH TUA JARANG DIJUAL DI CIDENG, LOKASI BAGUS! !","Cideng, Jakarta Pusat",4,3,,450 m²,450 m²,Rp 18 Miliar
1716900440-1238,https://www.rumah123.com/jual/jakarta-pusat/rumah/?sort=posted-desc&page=989,Rumah Mewah Daerah Menteng,"Menteng, Jakarta Pusat",5,5,4,1176 m²,1250 m²,Rp 165 Miliar
1716900440-1239,https://www.rumah123.com/jual/jakarta-pusat/rumah/?sort=posted-desc&page=989,(SALE) Rumah Siap Huni Ring 1 Menteng Jakarta Pusat Lokasi Strategis,"Menteng, Jakarta Pusat",1,2,,420 m²,500 m²,Rp 29 Miliar
1716900440-1240,https://www.rumah123.com/jual/jakarta-pusat/rumah/?sort=posted-desc&page=989,Sale Rumah Tinggal di Menteng Ada Kost An. Bagus Untuk Investasi,"Menteng, Jakarta Pusat",5,5,,160 m²,160 m²,"Rp 4,8 Miliar"
1716900457-1241,https://www.rumah123.com/jual/jakarta-pusat/rumah/?sort=posted-desc&page=988,"Turun Harga ..BU Rumah MURAH Super Mewah, Didaerah Super Elite Menteng Jakarta Pusat","Menteng, Jakarta Pusat",5,5,4,821 m²,1400 m²,Rp 57 Miliar
