web-scraper-order,web-scraper-start-url,name,location,bedroom,bathroom,garage,land_area,building_area,price
1716901302-2222,https://www.rumah123.com/jual/jakarta-pusat/rumah/?sort=posted-desc&page=939,Rumah langsung huni dan cantik,"Cempaka Putih, Jakarta Pusat",6,5,,500 m²,250 m²,Rp 16 Miliar
1716901302-2223,https://www.rumah123.com/jual/jakarta-pusat/rumah/?sort=posted-desc&page=939,rumah murah banget sederhana tengah kota di petojo jakarta pusat,"Petojo, Jakarta Pusat",3,2,1,61 m²,122 m²,"Rp 1,2 Miliar"
1716901302-2224,https://www.rumah123.com/jual/jakarta-pusat/rumah/?sort=posted-desc&page=939,"Rumah Cantik, Mewah di Menteng, Harga di Bawah Pasar","Menteng, Jakarta Pusat",6,3,,725 m²,550 m²,Rp 41 Miliar
1716901302-2225,https://www.rumah123.com/jual/jakarta-pusat/rumah/?sort=posted-desc&page=939,Rumah Mewah Jalan Teuku Cikditiro Menteng LT1078mtr Jakarta pusat,"Menteng, Jakarta Pusat",5,5,4,1078 m²,2018 m²,Rp 80 Miliar
1716901302-2226,https://www.rumah123.com/jual/jakarta-pusat/rumah/?sort=posted-desc&page=939,Rumah di Cempaka Putih Barat,"Cempaka Putih, Jakarta Pusat",3,2,2,300 m²,1 m²,"Rp 6,35 Miliar"
1716901302-2227,https://www.rumah123.com/jual/jakarta-pusat/rumah/?sort=posted-desc&page=939,Rumah langsung huni dan cantik,"Cempaka Putih, Jakarta Pusat",6,5,2,500 m²,250 m²,Rp 16 Miliar
1716901302-2228,https://www.rumah123.com/jual/jakarta-pusat/rumah/?sort=posted-desc&page=939,Rumah di Jln Sindanglaya Menteng Jual Cepat Nego,"Menteng, Jakarta Pusat",12,3,6,827 m²,619 m²,Rp 45 Miliar
1716901302-2229,https://www.rumah123.com/jual/jakarta-pusat/rumah/?sort=posted-desc&page=939,Rumah murah bagus tengah kota di Petojo Cideng Jakarta pusat,"Petojo, Jakarta Pusat",4,2,2,99 m²,150 m²,"Rp 2,35 Miliar"
1716901302-2230,https://www.rumah123.com/jual/jakarta-pusat/rumah/?sort=posted-desc&page=939,Dijual Rumah Cocok Untuk Kos Kosan Di Jakarta Pusat,"Senen, Jakarta Pusat",4,1,,161 m²,144 m²,"Rp 2,92 Miliar"
1716901302-2231,https://www.rumah123.com/jual/jakarta-pusat/rumah/?sort=posted-desc&page=939,Rumah di Benhill 2 Lantai SHM Baru Unfurnished,"Pejompongan, Jakarta Pusat",4,4,1,201 m²,310 m²,Rp 8 Miliar
1716901302-2232,https://www.rumah123.com/jual/jakarta-pusat/rumah/?sort=posted-desc&page=939,Rumah siap huni di pejompongan bendungan hilir jakarta pusat,"Pejompongan, Jakarta Pusat",3,1,,81 m²,100 m²,"Rp 3,5 Miliar"
1716901302-2233,https://www.rumah123.com/jual/jakarta-pusat/rumah/?sort=posted-desc&page=939,Rumah lokasi bagus di cempaka putih jakarta pusat,"Cempaka Putih, Jakarta Pusat",4,2,,330 m²,300 m²,"Rp 6,5 Miliar"
1716901302-2234,https://www.rumah123.com/jual/jakarta-pusat/rumah/?sort=posted-desc&page=939,Rumah besar dan bagus swimming pool di pegangsaan jakarta pusat,"Pegangsaan, Jakarta Pusat",7,7,3,650 m²,1500 m²,Rp 37 Miliar
1716901302-2235,https://www.rumah123.com/jual/jakarta-pusat/rumah/?sort=posted-desc&page=939,"Rumah Siap Huni Petojo 5x25, Lp152jun","Petojo, Jakarta Pusat",4,4,1,125 m²,210 m²,"Rp 3,2 Miliar"
1716901302-2236,https://www.rumah123.com/jual/jakarta-pusat/rumah/?sort=posted-desc&page=939,"Rumah Menteng, Jl. Cik Di Tiro, Jakarta Pusat","Menteng, Jakarta Pusat",5,4,,1078 m²,1200 m²,Rp 119 Miliar
1716901302-2237,https://www.rumah123.com/jual/jakarta-pusat/rumah/?sort=posted-desc&page=939,Rumah Mewah Menteng Area,"Menteng, Jakarta Pusat",9,7,3,925 m²,1485 m²,Rp 70 Miliar
1716901302-2238,https://www.rumah123.com/jual/jakarta-pusat/rumah/?sort=posted-desc&page=939,RUMAH HITUNG TANAH MENTENG LOKASI STRATEGIS COCOK UTK KANTOR,"Menteng, Jakarta Pusat",7,3,6,778 m²,407 m²,Rp 38 Miliar
1716901302-2239,https://www.rumah123.com/jual/jakarta-pusat/rumah/?sort=posted-desc&page=939,Dijual Rumah Tua di Bungur,"Bungur, Jakarta Pusat",,,,145 m²,,"Rp 2,5 Miliar"
1716901302-2240,https://www.rumah123.com/jual/jakarta-pusat/rumah/?sort=posted-desc&page=939,Dijual Rumah Siap Huni Cempaka Putih,"Cempaka Putih, Jakarta Pusat",4,3,2,210 m²,320 m²,"Rp 6,5 Miliar"
1716901314-2241,https://www.rumah123.com/jual/jakarta-pusat/rumah/?sort=posted-desc&page=938,"Jual Rumah Lama Terawat Siap Huni di Menteng, Jakarta Pusat","Menteng, Jakarta Pusat",6,5,2,662 m²,480 m²,Rp 45 Miliar
1716901314-2242,https://www.rumah123.com/jual/jakarta-pusat/rumah/?sort=posted-desc&page=938,Rumah Menteng Mungil Modern Nyaman Banget Dan Strategissss,"Menteng, Jakarta Pusat",4,3,4,275 m²,400 m²,"Rp 27,5 Miliar"
1716901314-2243,https://www.rumah123.com/jual/jakarta-pusat/rumah/?sort=posted-desc&page=938,Ruko cideng di jakarta pusat BU termurah,"Cideng, Jakarta Pusat",2,4,,160 m²,350 m²,"Rp 8,5 Miliar"
1716901314-2244,https://www.rumah123.com/jual/jakarta-pusat/rumah/?sort=posted-desc&page=938,Dijual murah rumah baru di lokasi strategis at Benhil Jakarta pusat,"Bendungan Hilir, Jakarta Pusat",3,4,2,210 m²,310 m²,Rp 8 Miliar
1716901314-2245,https://www.rumah123.com/jual/jakarta-pusat/rumah/?sort=posted-desc&page=938,"Rumah Daerah Elit, Menteng, Jakarta Pusat","Menteng, Jakarta Pusat",4,3,4,285 m²,450 m²,Rp 28 Miliar
1716901314-2246,https://www.rumah123.com/jual/jakarta-pusat/rumah/?sort=posted-desc&page=938,"Rumah Tua Hitung Tanah, Menteng, Jakarta Pusat","Menteng, Jakarta Pusat",3,1,,795 m²,400 m²,Rp 38 Miliar
1716901314-2247,https://www.rumah123.com/jual/jakarta-pusat/rumah/?sort=posted-desc&page=938,Rumah murah di Cempaka putih barat 2 Lantai Bagus,"Cempaka Putih, Jakarta Pusat",5,2,2,200 m²,220 m²,"Rp 4,25 Miliar"
1716901314-2248,https://www.rumah123.com/jual/jakarta-pusat/rumah/?sort=posted-desc&page=938,"RUMAH DIJUAL CEPAT DI LEMBANG MENTENG, DIBAWAH HARGA PASAR","Menteng, Jakarta Pusat",3,3,,312 m²,396 m²,"Rp 16,5 Miliar"
1716901314-2249,https://www.rumah123.com/jual/jakarta-pusat/rumah/?sort=posted-desc&page=938,"Kemayoran, Rumah Modern + Baru Didandanin, Taman Terawat","Kemayoran, Jakarta Pusat",3,3,2,150 m²,200 m²,"Rp 2,98 Miliar"
1716901314-2250,https://www.rumah123.com/jual/jakarta-pusat/rumah/?sort=posted-desc&page=938,"Rumah Mewah Harga Bawah Pasaran Dekat Diponegoro, Menteng","Menteng, Jakarta Pusat",6,5,2,733 m²,1100 m²,Rp 55 Miliar
1716901314-2251,https://www.rumah123.com/jual/jakarta-pusat/rumah/?sort=posted-desc&page=938,"Dijual Rumah Cempaka Putih Jalan Lebar, Strategis, Area Komersil","Cempaka Putih, Jakarta Pusat",6,2,,700 m²,650 m²,Rp 25 Miliar
1716901314-2252,https://www.rumah123.com/jual/jakarta-pusat/rumah/?sort=posted-desc&page=938,Dijual Cepat Rumah Di Menteng Murah !!!,"Menteng, Jakarta Pusat",12,5,10,827 m²,6195 m²,Rp 45 Miliar
1716901314-2253,https://www.rumah123.com/jual/jakarta-pusat/rumah/?sort=posted-desc&page=938,"Rumah 2 Lantai,Zona Komersil","Samanhudi, Jakarta Pusat",14,13,3,529 m²,500 m²,Rp 31 Miliar
1716901314-2254,https://www.rumah123.com/jual/jakarta-pusat/rumah/?sort=posted-desc&page=938,Rumah Unfurnished Bagus Sekali SHM  Menteng Jakarta,"Menteng, Jakarta Pusat",10,6,2,940 m²,1085 m²,Rp 85 Miliar
1716901314-2255,https://www.rumah123.com/jual/jakarta-pusat/rumah/?sort=posted-desc&page=938,"RUMAH SIAP HUNI,KONDISI BAIK TERAWAT,SHM","Kebon Kacang, Jakarta Pusat",3,2,1,81 m²,150 m²,"Rp 2,8 Miliar"
1716901314-2256,https://www.rumah123.com/jual/jakarta-pusat/rumah/?sort=posted-desc&page=938,Rumah di Jl Proklamasi,"Menteng, Jakarta Pusat",3,3,2,688 m²,300 m²,Rp 28 Miliar
1716901314-2257,https://www.rumah123.com/jual/jakarta-pusat/rumah/?sort=posted-desc&page=938,"Dijual Cepat, Rumah Menteng, Bawah Harga Pasaran, Harga Terbaik","Menteng, Jakarta Pusat",4,3,,659 m²,723 m²,Rp 41 Miliar
1716901314-2258,https://www.rumah123.com/jual/jakarta-pusat/rumah/?sort=posted-desc&page=938,"Rumah Lama Daerah Elite, Menteng, Jakarta Pusat","Menteng, Jakarta Pusat",3,2,2,735 m²,500 m²,Rp 65 Miliar
1716901314-2259,https://www.rumah123.com/jual/jakarta-pusat/rumah/?sort=posted-desc&page=938,"Rumah Vinatage Area Cikini , Shm, Jakarta Pusat","Cikini, Jakarta Pusat",7,2,1,568 m²,268 m²,"Rp 24,5 Miliar"
1716901314-2260,https://www.rumah123.com/jual/jakarta-pusat/rumah/?sort=posted-desc&page=938,"Gedung Apartenen Baru Private Lift, 9lantai , SHM , Jakarta Pusat","Cikini, Jakarta Pusat",18,12,12,511 m²,2478 m²,Rp 150 Miliar
1716901322-2261,https://www.rumah123.com/jual/jakarta-pusat/rumah/?sort=posted-desc&page=937,Golf Residence at Kemayoran Jakarta,"Kemayoran, Jakarta Pusat",4,3,1,200 m²,285 m²,Rp 10 Miliar
1716901322-2262,https://www.rumah123.com/jual/jakarta-pusat/rumah/?sort=posted-desc&page=937,Hot Sale Rumah Asri Terawat Siap Huni Daerah Menteng,"Menteng, Jakarta Pusat",8,5,2,778 m²,407 m²,Rp 38 Miliar
1716901322-2263,https://www.rumah123.com/jual/jakarta-pusat/rumah/?sort=posted-desc&page=937,Rumah Kebon Sirih,"Kebon Sirih, Jakarta Pusat",4,5,2,700 m²,500 m²,Rp 26 Miliar
1716901322-2264,https://www.rumah123.com/jual/jakarta-pusat/rumah/?sort=posted-desc&page=937,Rumah di Rawasari Jakarta Pusat,"Cempaka Putih, Jakarta Pusat",5,1,,158 m²,200 m²,"Rp 2,9 Miliar"
1716901322-2265,https://www.rumah123.com/jual/jakarta-pusat/rumah/?sort=posted-desc&page=937,Rumah di Cianjur Menteng 880m² Full Bangunan Baru,"Menteng, Jakarta Pusat",4,4,2,880 m²,1096 m²,Rp 90 Miliar
1716901322-2266,https://www.rumah123.com/jual/jakarta-pusat/rumah/?sort=posted-desc&page=937,Rumah Menteng Dijual Jalan Bondowoso Lokasi Tenang,"Menteng, Jakarta Pusat",4,4,,640 m²,800 m²,Rp 55 Miliar
1716901322-2267,https://www.rumah123.com/jual/jakarta-pusat/rumah/?sort=posted-desc&page=937,"Dijual Rumah Tua, Lingkungan Nyaman, Kondisi Terawat, Menteng","Menteng, Jakarta Pusat",12,3,,827 m²,6195 m²,Rp 39 Miliar
1716901322-2268,https://www.rumah123.com/jual/jakarta-pusat/rumah/?sort=posted-desc&page=937,Rumah Lt. 845 M2 SHM Menteng Jakarta Pusat,"Menteng, Jakarta Pusat",4,3,8,845 m²,300 m²,Rp 62 Miliar
1716901322-2269,https://www.rumah123.com/jual/jakarta-pusat/rumah/?sort=posted-desc&page=937,"Rumah Lama Area Istimewa Jl. Cempaka Putih, Jakarta Pusat","Cempaka Putih, Jakarta Pusat",6,5,4,500 m²,340 m²,Rp 12 Miliar
1716901322-2270,https://www.rumah123.com/jual/jakarta-pusat/rumah/?sort=posted-desc&page=937,Rumah Siap Huni di Petojo Jakarta Pusat (rathad),"Petojo, Jakarta Pusat",5,3,1,365 m²,400 m²,"Rp 12,5 Miliar"
1716901322-2271,https://www.rumah123.com/jual/jakarta-pusat/rumah/?sort=posted-desc&page=937,Rumah Kos Kosan Di Lokasi Strategis Di Bendungan Hilir Jakarta Pusat,"Bendungan Hilir, Jakarta Pusat",28,28,,515 m²,484 m²,Rp 25 Miliar
1716901322-2272,https://www.rumah123.com/jual/jakarta-pusat/rumah/?sort=posted-desc&page=937,"Menteng Rumah Cozy Pinggir Jl.raya Raden Saleh Cikini,menteng","Cikini, Jakarta Pusat",4,3,2,250 m²,130 m²,Rp 17 Miliar
1716901322-2273,https://www.rumah123.com/jual/jakarta-pusat/rumah/?sort=posted-desc&page=937,Rumah Nyaman dan Asri di Cempaka Putih Jakarta Pusat,"Cempaka Putih, Jakarta Pusat",4,2,1,532 m²,350 m²,"Rp 14,5 Miliar"
1716901322-2274,https://www.rumah123.com/jual/jakarta-pusat/rumah/?sort=posted-desc&page=937,"Murah Banget Turun 25 M, Rumah Mewah di Menteng","Menteng, Jakarta Pusat",8,8,10,700 m²,2000 m²,Rp 70 Miliar
1716901322-2275,https://www.rumah123.com/jual/jakarta-pusat/rumah/?sort=posted-desc&page=937,Rumah Asri di Bendungan Hilir,"Bendungan Hilir, Jakarta Pusat",3,3,,268 m²,120 m²,Rp 10 Miliar
1716901322-2276,https://www.rumah123.com/jual/jakarta-pusat/rumah/?sort=posted-desc&page=937,Rumah Menteng Classic Cantik Cocok Untuk Keluarga,"Menteng, Jakarta Pusat",5,6,,500 m²,700 m²,Rp 40 Miliar
1716901322-2277,https://www.rumah123.com/jual/jakarta-pusat/rumah/?sort=posted-desc&page=937,"Rumah Cantik Terawat di Menteng, Luas Banget","Menteng, Jakarta Pusat",5,5,,1100 m²,950 m²,Rp 110 Miliar
1716901322-2278,https://www.rumah123.com/jual/jakarta-pusat/rumah/?sort=posted-desc&page=937,Rumah siap huni Bagus di Benhil,"Bendungan Hilir, Jakarta Pusat",3,2,1,117 m²,160 m²,"Rp 4,37 Miliar"
1716901322-2279,https://www.rumah123.com/jual/jakarta-pusat/rumah/?sort=posted-desc&page=937,"Bangunan Tua Hitung Tanah di Gambir, Jakarta Barat A S","Gambir, Jakarta Pusat",,,,650 m²,,Rp 24 Miliar
1716901322-2280,https://www.rumah123.com/jual/jakarta-pusat/rumah/?sort=posted-desc&page=937,Rumah dekat pusat bisnis Sudirman Pejompongan Jakarta Pusat,"Pejompongan, Jakarta Pusat",7,2,2,220 m²,270 m²,"Rp 10,8 Miliar"
1716901331-2281,https://www.rumah123.com/jual/jakarta-pusat/rumah/?sort=posted-desc&page=936,"Rumah 2 Lantai Sertifikat Hak Milik di Pasar Baru, Jakarta Pusat","Pasar Baru, Jakarta Pusat",5,4,1,190 m²,176 m²,"Rp 3,7 Miliar"
1716901331-2282,https://www.rumah123.com/jual/jakarta-pusat/rumah/?sort=posted-desc&page=936,Dijual cepat Rumah di Blossom Residance Kemayoran ada lift,"Kemayoran, Jakarta Pusat",4,4,4,250 m²,560 m²,Rp 11 Miliar
1716901331-2283,https://www.rumah123.com/jual/jakarta-pusat/rumah/?sort=posted-desc&page=936,"Rumah Siap Huni di Menteng, Jakarta Pusat","Menteng, Jakarta Pusat",4,3,3,839 m²,461 m²,Rp 55 Miliar
1716901331-2284,https://www.rumah123.com/jual/jakarta-pusat/rumah/?sort=posted-desc&page=936,Dijual Disewa Rumah di Cempaka Putih,"Cempaka Putih, Jakarta Pusat",3,2,,201 m²,201 m²,Rp 5 Miliar
1716901331-2285,https://www.rumah123.com/jual/jakarta-pusat/rumah/?sort=posted-desc&page=936,rumah murah tengah kota di petojo selatan jakarta pusat,"Petojo, Jakarta Pusat",2,2,,93 m²,100 m²,"Rp 1,6 Miliar"
1716901331-2286,https://www.rumah123.com/jual/jakarta-pusat/rumah/?sort=posted-desc&page=936,Rumah Tua Kelinci Raya Pasar Baru Luas 169m2 SHM,"Sawah Besar, Jakarta Pusat",,,,300 m²,,"Rp 4,9 Miliar"
1716901331-2287,https://www.rumah123.com/jual/jakarta-pusat/rumah/?sort=posted-desc&page=936,jual Rumah Menteng Di Lingkungan Ramai Cocok Buat Bisnis Me888,"Menteng, Jakarta Pusat",2,2,3,386 m²,254 m²,Rp 20 Miliar
1716901331-2288,https://www.rumah123.com/jual/jakarta-pusat/rumah/?sort=posted-desc&page=936,Rumah Jl. Dr. Kusuma Atmaja Menteng Jakarta Pusat,"Menteng, Jakarta Pusat",5,3,4,820 m²,650 m²,Rp 82 Miliar
1716901331-2289,https://www.rumah123.com/jual/jakarta-pusat/rumah/?sort=posted-desc&page=936,Rumah Cokroaminoto Menteng Jakarta Pusat,"Menteng, Jakarta Pusat",10,10,10,1663 m²,3000 m²,Rp 175 Miliar
1716901331-2290,https://www.rumah123.com/jual/jakarta-pusat/rumah/?sort=posted-desc&page=936,Rumah tua strategis tengah kota di petojo selatan cideng jakarta pusat,"Petojo, Jakarta Pusat",6,3,2,251 m²,199 m²,"Rp 6,5 Miliar"
1716901331-2291,https://www.rumah123.com/jual/jakarta-pusat/rumah/?sort=posted-desc&page=936,Kos Kosan di Jalan Percetakan Negara Johar Baru Jakarta Pusat,"Johar Baru, Jakarta Pusat",9,8,2,161 m²,260 m²,"Rp 2,5 Miliar"
1716901331-2292,https://www.rumah123.com/jual/jakarta-pusat/rumah/?sort=posted-desc&page=936,Rumah tua murah hitung tanah di petojo jakarta pusat,"Petojo, Jakarta Pusat",1,1,1,78 m²,60 m²,"Rp 1,45 Miliar"
1716901331-2293,https://www.rumah123.com/jual/jakarta-pusat/rumah/?sort=posted-desc&page=936,Rumah Kos-Kosan Aktif di Jakarta Pusat.,"Bendungan Hilir, Jakarta Pusat",,,,33366 m²,,"Rp 4,9 Miliar"
1716901331-2294,https://www.rumah123.com/jual/jakarta-pusat/rumah/?sort=posted-desc&page=936,Rumah 2 Lantai Bagus Semi Furnished SHM di Cempaka Putih Barat,"Cempaka Putih, Jakarta Pusat",4,2,1,70 m²,170 m²,Rp 3 Miliar
1716901331-2295,https://www.rumah123.com/jual/jakarta-pusat/rumah/?sort=posted-desc&page=936,Rumah Percetakan negara 2 Lantai SHM Bagus Sekali Unfurnished,"Percetakan Negara, Jakarta Pusat",3,2,1,360 m²,200 m²,"Rp 4,3 Miliar"
1716901331-2296,https://www.rumah123.com/jual/jakarta-pusat/rumah/?sort=posted-desc&page=936,For Sale Rumah di Cempaka putih 2 Lantai Lokasi Strategis,"Cempaka Putih, Jakarta Pusat",5,5,2,288 m²,400 m²,Rp 14 Miliar
1716901331-2297,https://www.rumah123.com/jual/jakarta-pusat/rumah/?sort=posted-desc&page=936,Rumah modern minimalis 2 lantai full furnish menteng,"Menteng, Jakarta Pusat",3,3,1,156 m²,285 m²,Rp 16 Miliar
1716901331-2298,https://www.rumah123.com/jual/jakarta-pusat/rumah/?sort=posted-desc&page=936,Rumah Tua Komplek Permata Angkasa Kemayoran Hitung Tanah,"Kemayoran, Jakarta Pusat",3,2,,243 m²,200 m²,"Rp 4,5 Miliar"
1716901331-2299,https://www.rumah123.com/jual/jakarta-pusat/rumah/?sort=posted-desc&page=936,di Jl.kaji petojo,"Petojo, Jakarta Pusat",5,2,2,365 m²,400 m²,"Rp 12,5 Miliar"
1716901331-2300,https://www.rumah123.com/jual/jakarta-pusat/rumah/?sort=posted-desc&page=936,"Dijual Cepat Rumah Cantik 2 lantai di jl. Lembang Terusan, Menteng Jakarta Pusat!","Menteng, Jakarta Pusat",4,3,1,312 m²,450 m²,"Rp 17,2 Miliar"
1716901339-2301,https://www.rumah123.com/jual/jakarta-pusat/rumah/?sort=posted-desc&page=935,Rumah Cantik Nan Mewah 2 Lantai di Menteng Jakarta Pusat,"Menteng, Jakarta Pusat",4,5,,1046 m²,800 m²,Rp 150 Miliar
1716901339-2302,https://www.rumah123.com/jual/jakarta-pusat/rumah/?sort=posted-desc&page=935,Rumah dijual menteng cilacap,"Menteng, Jakarta Pusat",,,,150 m²,,Rp 18 Miliar
1716901339-2303,https://www.rumah123.com/jual/jakarta-pusat/rumah/?sort=posted-desc&page=935,"Dijual Rumah Dikomplek Cempaka Putih Barat, Cempaka Putih,jakpus","Cempaka Putih, Jakarta Pusat",3,2,1,157 m²,157 m²,"Rp 3,5 Miliar"
1716901339-2304,https://www.rumah123.com/jual/jakarta-pusat/rumah/?sort=posted-desc&page=935,Jual Rumah Tua Gunung Sahari Hitung Tanah Harga Njop,"Gunung Sahari, Jakarta Pusat",3,2,2,419 m²,100 m²,"Rp 6,7 Miliar"
1716901339-2305,https://www.rumah123.com/jual/jakarta-pusat/rumah/?sort=posted-desc&page=935,Rumah Sangat Strategis di Lokasi Bagus Jalan Kesehatan,"Gambir, Jakarta Pusat",9,4,1,589 m²,1000 m²,"Rp 22,5 Miliar"
1716901339-2306,https://www.rumah123.com/jual/jakarta-pusat/rumah/?sort=posted-desc&page=935,"Di Jual Cepat Rumah Cempaka Putih, Jalan Lebar Cocok Untuk Buka Usaha","Cempaka Putih, Jakarta Pusat",19,16,,500 m²,247 m²,Rp 9 Miliar
1716901339-2307,https://www.rumah123.com/jual/jakarta-pusat/rumah/?sort=posted-desc&page=935,"RUMAH LAMA DI CIDENG, JAKARTA PUSAT","Cideng, Jakarta Pusat",2,2,3,264 m²,150 m²,Rp 7 Miliar
1716901339-2308,https://www.rumah123.com/jual/jakarta-pusat/rumah/?sort=posted-desc&page=935,"Murah & Cepat Hunian Mewah Tenang di Menteng, Jakarta Pusat","Menteng, Jakarta Pusat",7,8,2,733 m²,548 m²,Rp 45 Miliar
1716901339-2309,https://www.rumah123.com/jual/jakarta-pusat/rumah/?sort=posted-desc&page=935,"Jual Cepat Rumah Bangunan Zaman Belanda di Menteng, Jakarta Pusat","Menteng, Jakarta Pusat",14,7,5,947 m²,739 m²,Rp 44 Miliar
1716901339-2310,https://www.rumah123.com/jual/jakarta-pusat/rumah/?sort=posted-desc&page=935,Langka Jual Rumah Mewah di Menteng Bagus,"Menteng, Jakarta Pusat",9,5,10,925 m²,1485 m²,Rp 69 Miliar
1716901339-2311,https://www.rumah123.com/jual/jakarta-pusat/rumah/?sort=posted-desc&page=935,Rumah di Menteng Jakarta pusat,"Menteng, Jakarta Pusat",,,,400 m²,,Rp 55 Miliar
1716901339-2312,https://www.rumah123.com/jual/jakarta-pusat/rumah/?sort=posted-desc&page=935,Ruang Kantor lokasi di Tanah Abang Jakarta Pusat,"Tanah Abang, Jakarta Pusat",1,,,61 m²,61 m²,"Rp 2,3 Miliar"
1716901339-2313,https://www.rumah123.com/jual/jakarta-pusat/rumah/?sort=posted-desc&page=935,"Rumah Kost Pasar Baru 4,5 Lantai Strategis","Pasar Baru, Jakarta Pusat",45,10,,233 m²,750 m²,Rp 14 Miliar
1716901339-2314,https://www.rumah123.com/jual/jakarta-pusat/rumah/?sort=posted-desc&page=935,"RUMAH SIAP HUNI MINIMALIS 3 LANTAI DI CIDENG, JAKARTA PUSAT","Cideng, Jakarta Pusat",4,3,1,70 m²,150 m²,Rp 3 Miliar
1716901339-2315,https://www.rumah123.com/jual/jakarta-pusat/rumah/?sort=posted-desc&page=935,Rumah 2 Lantai Bagus di Menteng Jakarta Pusat,"Menteng, Jakarta Pusat",5,4,10,720 m²,550 m²,Rp 80 Miliar
1716901339-2316,https://www.rumah123.com/jual/jakarta-pusat/rumah/?sort=posted-desc&page=935,Rumah di Jl. Prof. Moh. Yamin Menteng Luas 925m,"Menteng, Jakarta Pusat",9,5,,925 m²,1485 m²,Rp 65 Miliar
1716901339-2317,https://www.rumah123.com/jual/jakarta-pusat/rumah/?sort=posted-desc&page=935,Salah Satu Rumah Termewah Area Menteng. Ada Home Theatre,"Menteng, Jakarta Pusat",4,4,,950 m²,1500 m²,Rp 110 Miliar
1716901339-2318,https://www.rumah123.com/jual/jakarta-pusat/rumah/?sort=posted-desc&page=935,Rumah Semi Furnished SHM - Sertifikat Hak Milik di Petojo,"Petojo, Jakarta Pusat",3,3,1,120 m²,150 m²,"Rp 5,25 Miliar"
1716901339-2319,https://www.rumah123.com/jual/jakarta-pusat/rumah/?sort=posted-desc&page=935,JUAL RUMAH PRIME AREA MENTENG,"Menteng, Jakarta Pusat",4,4,2,212 m²,318 m²,Rp 19 Miliar
1716901339-2320,https://www.rumah123.com/jual/jakarta-pusat/rumah/?sort=posted-desc&page=935,JUAL RUMAH PRIME AREA MENTENG,"Menteng, Jakarta Pusat",4,4,2,212 m²,318 m²,Rp 19 Miliar
1716901346-2321,https://www.rumah123.com/jual/jakarta-pusat/rumah/?sort=posted-desc&page=934,"Rumah 3,5 Lantai Siap Huni di Petojo - Cideng 
Jakarta Pusat (Well.GPP)","Cideng, Jakarta Pusat",3,3,4,171 m²,442 m²,"Rp 6,8 Miliar"
1716901346-2322,https://www.rumah123.com/jual/jakarta-pusat/rumah/?sort=posted-desc&page=934,Rumah tua lokasi bagus di Menteng Jakarta pusat,"Menteng, Jakarta Pusat",12,4,2,827 m²,619 m²,Rp 39 Miliar
1716901346-2323,https://www.rumah123.com/jual/jakarta-pusat/rumah/?sort=posted-desc&page=934,#TURUN HARGA# RUMAH EXCLUSIVE LENGKAP DENGAN KOLAM RENANG DI KAWASAN ELITE,"Menteng, Jakarta Pusat",6,6,,733 m²,1100 m²,Rp 56 Miliar
1716901346-2324,https://www.rumah123.com/jual/jakarta-pusat/rumah/?sort=posted-desc&page=934,Rumah 2 unit sangat strategis di daerah Benhil Jakarta Pusat Dekat Area Perkantoran,"Bendungan Hilir, Jakarta Pusat",8,6,2,314 m²,218 m²,Rp 15 Miliar
1716901346-2325,https://www.rumah123.com/jual/jakarta-pusat/rumah/?sort=posted-desc&page=934,Dijual Rumah 2 Lantai di Cempaka putih tengah Baru jakpus,"Cempaka Putih, Jakarta Pusat",4,4,2,308 m²,412 m²,"Rp 10,9 Miliar"
1716901346-2326,https://www.rumah123.com/jual/jakarta-pusat/rumah/?sort=posted-desc&page=934,Dijual Rumah di Cempaka putih tengah 2 Lantai siap huni jakpus,"Cempaka Putih, Jakarta Pusat",4,3,2,180 m²,280 m²,"Rp 7,2 Miliar"
1716901346-2327,https://www.rumah123.com/jual/jakarta-pusat/rumah/?sort=posted-desc&page=934,Rumah murah pusat kota dekat gajah mada jakarta pusat,"Petojo, Jakarta Pusat",4,3,,353 m²,250 m²,"Rp 6,75 Miliar"
1716901346-2328,https://www.rumah123.com/jual/jakarta-pusat/rumah/?sort=posted-desc&page=934,Hotel bintang 3 masih beroperasional Jakarta Pusat,"Cideng, Jakarta Pusat",99,11,25,1196 m²,6902 m²,Rp 69 Miliar
1716901346-2329,https://www.rumah123.com/jual/jakarta-pusat/rumah/?sort=posted-desc&page=934,Rumah mewah di jakarta pusat,"Senen, Jakarta Pusat",5,3,3,301 m²,350 m²,Rp 17 Miliar
1716901346-2330,https://www.rumah123.com/jual/jakarta-pusat/rumah/?sort=posted-desc&page=934,"Rumah Dijual Jalan Bondowoso, Menteng","Menteng, Jakarta Pusat",4,4,,640 m²,800 m²,Rp 55 Miliar
1716901346-2331,https://www.rumah123.com/jual/jakarta-pusat/rumah/?sort=posted-desc&page=934,Dijual Rumah Baru di Jl Semarang Menteng,"Menteng, Jakarta Pusat",,,,778 m²,,Rp 33 Miliar
1716901346-2332,https://www.rumah123.com/jual/jakarta-pusat/rumah/?sort=posted-desc&page=934,Siap Huni Rumah di Cempaka Putih,"Cempaka Putih, Jakarta Pusat",4,4,2,308 m²,412 m²,"Rp 10,5 Miliar"
1716901346-2333,https://www.rumah123.com/jual/jakarta-pusat/rumah/?sort=posted-desc&page=934,Rumah di Cempaka Putih Tengah,"Cempaka Putih, Jakarta Pusat",4,4,2,180 m²,280 m²,"Rp 7,2 Miliar"
1716901346-2334,https://www.rumah123.com/jual/jakarta-pusat/rumah/?sort=posted-desc&page=934,JUAL RUMAH MEWAH  DUKUH ATAS. JUAL CEPAT!!,"Kebon Melati, Jakarta Pusat",8,8,5,682 m²,1731 m²,Rp 85 Miliar
1716901346-2335,https://www.rumah123.com/jual/jakarta-pusat/rumah/?sort=posted-desc&page=934,"Rumah 2 Lantai Siap Huni  Cempaka Putih Barat, Jakarta Pusat","Cempaka Putih, Jakarta Pusat",5,3,,134 m²,174 m²,"Rp 3,2 Miliar"
1716901346-2336,https://www.rumah123.com/jual/jakarta-pusat/rumah/?sort=posted-desc&page=934,Dijual rumah bagus cempaka putih,"Cempaka Putih, Jakarta Pusat",14,8,4,360 m²,600 m²,Rp 9 Miliar
1716901346-2337,https://www.rumah123.com/jual/jakarta-pusat/rumah/?sort=posted-desc&page=934,Rumah bagus cocok untuk kos-kosan,"Kartini, Jakarta Pusat",6,4,2,499 m²,700 m²,Rp 8 Miliar
1716901346-2338,https://www.rumah123.com/jual/jakarta-pusat/rumah/?sort=posted-desc&page=934,"Dijual Rumah Dikomplek Cempaka Putih Barat, Cempaka Putih,jakpus","Cempaka Putih, Jakarta Pusat",3,2,1,157 m²,157 m²,"Rp 4,75 Miliar"
1716901346-2339,https://www.rumah123.com/jual/jakarta-pusat/rumah/?sort=posted-desc&page=934,Rumah Jalan Hos Cokroaminoto Lt 363Mtr Menteng Jakarta Pusat,"Menteng, Jakarta Pusat",5,3,2,363 m²,500 m²,Rp 22 Miliar
1716901346-2340,https://www.rumah123.com/jual/jakarta-pusat/rumah/?sort=posted-desc&page=934,Rumah Asri di Kapuas Cideng Siap Huni Jual Cepatt Nego,"Cideng, Jakarta Pusat",4,3,2,204 m²,180 m²,"Rp 5,5 Miliar"
1716901353-2341,https://www.rumah123.com/jual/jakarta-pusat/rumah/?sort=posted-desc&page=933,"RUMAH BAGUS SIAP HUNI 2 LANTAI DI CIDENG, JAKARTA PUSAT","Cideng, Jakarta Pusat",5,3,4,300 m²,400 m²,Rp 9 Miliar
1716901353-2342,https://www.rumah123.com/jual/jakarta-pusat/rumah/?sort=posted-desc&page=933,"RUMAH DI ,MENTENG,JAKARTA PUSAT.","Menteng, Jakarta Pusat",8,5,3,915 m²,680 m²,Rp 68 Miliar
1716901353-2343,https://www.rumah123.com/jual/jakarta-pusat/rumah/?sort=posted-desc&page=933,CEPAT RUMAH MENTENG AREA BAGUS PINNGIR JALAN JAKARTA PUSAT,"Menteng, Jakarta Pusat",2,1,2,970 m²,550 m²,Rp 82 Miliar
1716901353-2344,https://www.rumah123.com/jual/jakarta-pusat/rumah/?sort=posted-desc&page=933,Rumah Modern Minimalis Siap Huni di Menteng,"Menteng, Jakarta Pusat",9,8,2,395 m²,778 m²,Rp 33 Miliar
1716901353-2345,https://www.rumah123.com/jual/jakarta-pusat/rumah/?sort=posted-desc&page=933,"Rumah siap huni,di Menteng Jakarta pusat, lokasi sangat strategis","Menteng, Jakarta Pusat",,,,800 m²,,Rp 100 Miliar
1716901353-2346,https://www.rumah123.com/jual/jakarta-pusat/rumah/?sort=posted-desc&page=933,"Revisi Conect Dgn Ruko Kendal, Rumah Di Menteng, Jakarta Pusat.","Menteng, Jakarta Pusat",,,,,,"Rp 5,5 Miliar"
