web-scraper-order,web-scraper-start-url,name,location,bedroom,bathroom,garage,land_area,building_area,price
1716901767-3330,https://www.rumah123.com/jual/jakarta-pusat/rumah/?sort=posted-desc&page=884,Cideng Rumah Dekat Area Perkantoran,"Cideng, Jakarta Pusat",6,4,2,200 m²,350 m²,Rp 8 Miliar
1716901767-3331,https://www.rumah123.com/jual/jakarta-pusat/rumah/?sort=posted-desc&page=884,Rumah di Petojo VIY - Jakarta pusat,"Petojo, Jakarta Pusat",2,3,4,171 m²,445 m²,"Rp 6,8 Miliar"
1716901767-3332,https://www.rumah123.com/jual/jakarta-pusat/rumah/?sort=posted-desc&page=884,Rumah Klasik yg indah dan nyaman,"Menteng, Jakarta Pusat",12,6,2,840 m²,490 m²,Rp 72 Miliar
1716901767-3333,https://www.rumah123.com/jual/jakarta-pusat/rumah/?sort=posted-desc&page=884,"Turun Harga!!  Rumah Bagus Siap Huni Di Pegangsaan, Menteng","Pegangsaan, Jakarta Pusat",7,7,1,650 m²,1500 m²,Rp 24 Miliar
1716901767-3334,https://www.rumah123.com/jual/jakarta-pusat/rumah/?sort=posted-desc&page=884,Sale Rumah Dan 4 Kamar Kost Di Daerah Bendungan Hilir Me0011,"Bendungan Hilir, Jakarta Pusat",7,2,1,236 m²,206 m²,Rp 9 Miliar
1716901767-3335,https://www.rumah123.com/jual/jakarta-pusat/rumah/?sort=posted-desc&page=884,Dijual Segera Rumah Luas Di Jakarta Pusat di Tepi Jalan Raya,"Cempaka Putih, Jakarta Pusat",5,4,3,250 m²,300 m²,"Rp 5,2 Miliar"
1716901767-3336,https://www.rumah123.com/jual/jakarta-pusat/rumah/?sort=posted-desc&page=884,Rumah Harga di Bawah Pasaran Cempaka Putih,"Cempaka Putih, Jakarta Pusat",,,,225 m²,,"Rp 6,5 Miliar"
1716901767-3337,https://www.rumah123.com/jual/jakarta-pusat/rumah/?sort=posted-desc&page=884,Rumah mewah dan asri di Menteng-Jakarta Pusat,"Menteng, Jakarta Pusat",5,3,6,720 m²,1200 m²,Rp 59 Miliar
1716901767-3338,https://www.rumah123.com/jual/jakarta-pusat/rumah/?sort=posted-desc&page=884,"Rumah Dengan Lokasi Premium Di Menteng, Jakarta Pusat","Menteng, Jakarta Pusat",5,3,1,748 m²,500 m²,Rp 80 Miliar
1716901767-3339,https://www.rumah123.com/jual/jakarta-pusat/rumah/?sort=posted-desc&page=884,Rumah Lebar 10 Di Cideng Dekat Itc Roxy Mas,"Cideng, Jakarta Pusat",3,2,1,140 m²,240 m²,Rp 5 Miliar
1716901767-3340,https://www.rumah123.com/jual/jakarta-pusat/rumah/?sort=posted-desc&page=884,Jual Cepat Rumah Tua Standart Gang 1 Motor di Gunung Sahari,"Sawah Besar, Jakarta Pusat",1,1,,63 m²,1 m²,Rp 800 Juta
1716901775-3341,https://www.rumah123.com/jual/jakarta-pusat/rumah/?sort=posted-desc&page=883,"RUMAH LAMA DI MENTENG, JAKARTA PUSAT","Menteng, Jakarta Pusat",3,4,,441 m²,350 m²,Rp 32 Miliar
1716901775-3342,https://www.rumah123.com/jual/jakarta-pusat/rumah/?sort=posted-desc&page=883,Rumah Mewah di Kramat Senen. Jakarta Pusat. Harus terjual bulan ini,"Kramat, Jakarta Pusat",7,7,3,376 m²,650 m²,Rp 9 Miliar
1716901775-3343,https://www.rumah123.com/jual/jakarta-pusat/rumah/?sort=posted-desc&page=883,Rumah Tua Hitung Tanah di Menteng Luas 514m2 Dibawah Pasaran,"Menteng, Jakarta Pusat",4,2,,514 m²,250 m²,"Rp 10,2 Miliar"
1716901775-3344,https://www.rumah123.com/jual/jakarta-pusat/rumah/?sort=posted-desc&page=883,For sale rumah bagus dan mewah di jakarta pusat,"Menteng, Jakarta Pusat",7,8,,733 m²,548 m²,Rp 45 Miliar
1716901775-3345,https://www.rumah123.com/jual/jakarta-pusat/rumah/?sort=posted-desc&page=883,"Rumah Hitung Tanah Jln Kramat Ii Kramat Kwitang Jakpus , Jakarta Pusat","Senen, Jakarta Pusat",,,,500 m²,,Rp 11 Miliar
1716901775-3346,https://www.rumah123.com/jual/jakarta-pusat/rumah/?sort=posted-desc&page=883,Rumah Lokasi Strategis di Jln Kramat Ii Kwitang Jakpus,"Senen, Jakarta Pusat",,,,400 m²,,Rp 8 Miliar
1716901775-3347,https://www.rumah123.com/jual/jakarta-pusat/rumah/?sort=posted-desc&page=883,"RUMAH HOOK 2,5 LANTAI DIPETOJO  / KESEHATAN JAKPUS","Petojo, Jakarta Pusat",4,3,,137 m²,150 m²,"Rp 4,5 Miliar"
1716901775-3348,https://www.rumah123.com/jual/jakarta-pusat/rumah/?sort=posted-desc&page=883,Dijual Rumah Lama Masih Bagus Di Gunung Sehari Jakarta Pusat,"Senen, Jakarta Pusat",3,3,,508 m²,506 m²,Rp 19 Miliar
1716901775-3349,https://www.rumah123.com/jual/jakarta-pusat/rumah/?sort=posted-desc&page=883,"JARANG ADA RUMAH MINIMALIS,KALASAN MENTENG","Menteng, Jakarta Pusat",6,4,1,266 m²,350 m²,Rp 15 Miliar
1716901775-3350,https://www.rumah123.com/jual/jakarta-pusat/rumah/?sort=posted-desc&page=883,Rumah Semi Furnished SHM - Sertifikat Hak Milik di Menteng,"Menteng, Jakarta Pusat",7,2,4,716 m²,404 m²,Rp 49 Miliar
1716901775-3351,https://www.rumah123.com/jual/jakarta-pusat/rumah/?sort=posted-desc&page=883,JUAL RUMAH BENDUNGAN HILIR,"Bendungan Hilir, Jakarta Pusat",4,3,,136 m²,200 m²,"Rp 5,5 Miliar"
1716901775-3352,https://www.rumah123.com/jual/jakarta-pusat/rumah/?sort=posted-desc&page=883,Rumah tua di belakang plaza indonesia bagus untuk bisnis kos kosan,"Tanah Abang, Jakarta Pusat",,,,132 m²,,"Rp 3,9 Miliar"
1716901775-3353,https://www.rumah123.com/jual/jakarta-pusat/rumah/?sort=posted-desc&page=883,"Rumah Kartini 5 Dalam Jakarta Pusat, Luas 166 M2","Kartini, Jakarta Pusat",5,2,,166 m²,250 m²,"Rp 3,2 Miliar"
1716901775-3354,https://www.rumah123.com/jual/jakarta-pusat/rumah/?sort=posted-desc&page=883,Rumah 2 lantai siap huni lokasi cukup strategis,"Kemayoran, Jakarta Pusat",3,3,,142 m²,237 m²,"Rp 2,7 Miliar"
1716901775-3355,https://www.rumah123.com/jual/jakarta-pusat/rumah/?sort=posted-desc&page=883,Dijual Rumah Untuk Tempat Usaha Kawasan Kemayoran Jakarta Pusat,"Kemayoran, Jakarta Pusat",4,2,,443 m²,400 m²,"Rp 9,8 Miliar"
1716901775-3356,https://www.rumah123.com/jual/jakarta-pusat/rumah/?sort=posted-desc&page=883,Di jual 5 unit kontrakan murah luas 300m²,"Cempaka Putih, Jakarta Pusat",,,,300 m²,,"Rp 2,5 Miliar"
1716901775-3357,https://www.rumah123.com/jual/jakarta-pusat/rumah/?sort=posted-desc&page=883,"Rumah di Dwiwarna Ekonomi, Mangga Besar Jakarta Pusat","Sawah Besar, Jakarta Pusat",3,2,1,119 m²,98 m²,"Rp 1,35 Miliar"
1716901775-3358,https://www.rumah123.com/jual/jakarta-pusat/rumah/?sort=posted-desc&page=883,Dijual Murah Rumah Petojo Sabangan Jakarta Pusat,"Petojo, Jakarta Pusat",4,4,,400 m²,400 m²,Rp 16 Miliar
1716901775-3359,https://www.rumah123.com/jual/jakarta-pusat/rumah/?sort=posted-desc&page=883,Dijual Cepat Rumah di Cempaka Putih Jakarta Pusat Dengan Akses Jalan Lebar Bebas Banjir,"Cempaka Putih, Jakarta Pusat",7,5,3,500 m²,340 m²,"Rp 10,5 Miliar"
1716901775-3360,https://www.rumah123.com/jual/jakarta-pusat/rumah/?sort=posted-desc&page=883,JUAL RUMAH BENDUNGAN HILIR,"Bendungan Hilir, Jakarta Pusat",,,,200 m²,,"Rp 5,5 Miliar"
1716901784-3361,https://www.rumah123.com/jual/jakarta-pusat/rumah/?sort=posted-desc&page=882,Dijual Rumah Petojo Utara Gambir Jakarta Pusat 3lantai,"Petojo, Jakarta Pusat",,,,260 m²,,"Rp 3,6 Miliar"
1716901784-3362,https://www.rumah123.com/jual/jakarta-pusat/rumah/?sort=posted-desc&page=882,"RUMAH CIKINI, JAKARTA PUSAT","Cikini, Jakarta Pusat",8,4,,1080 m²,400 m²,Rp 55 Miliar
1716901784-3363,https://www.rumah123.com/jual/jakarta-pusat/rumah/?sort=posted-desc&page=882,"Rumah Bisa Untuk Usaha Di Cempaka Putih, Jakarta Pusat","Cempaka Putih, Jakarta Pusat",5,3,,569 m²,425 m²,Rp 17 Miliar
1716901784-3364,https://www.rumah123.com/jual/jakarta-pusat/rumah/?sort=posted-desc&page=882,"Dijual rumah mewah  di menteng jakarta , jakarta pusat","Menteng, Jakarta Pusat",6,6,5,733 m²,1100 m²,Rp 45 Miliar
1716901784-3365,https://www.rumah123.com/jual/jakarta-pusat/rumah/?sort=posted-desc&page=882,Dijual Cepat Rumah Di Petojo Melintang Cocok untuk Kos kosan/Perkantoran/Bisnis Lainya,"Gambir, Jakarta Pusat",4,4,,619 m²,407 m²,Rp 19 Miliar
1716901784-3366,https://www.rumah123.com/jual/jakarta-pusat/rumah/?sort=posted-desc&page=882,"Jual Townhome Le Parc Thamrin Nine Complex Tanah Abang, Jak Pus","Tanah Abang, Jakarta Pusat",4,,,640 m²,640 m²,"Rp 41,5 Miliar"
1716901784-3367,https://www.rumah123.com/jual/jakarta-pusat/rumah/?sort=posted-desc&page=882,"Rrumah Baru Di Cempaka Putih, Jakarta Pusat","Cempaka Putih, Jakarta Pusat",2,2,,36 m²,68 m²,"Rp 1,52 Miliar"
1716901784-3368,https://www.rumah123.com/jual/jakarta-pusat/rumah/?sort=posted-desc&page=882,"Rumah Tinggal Akses 2 Mobil, Persis Belakang Kantor Kecamatan Senen","Kramat, Jakarta Pusat",4,4,2,202 m²,350 m²,"Rp 5,48 Miliar"
1716901784-3369,https://www.rumah123.com/jual/jakarta-pusat/rumah/?sort=posted-desc&page=882,"Rumah Tinggal Akses 2 Mobil, Persis Belakang Kantor Kecamatan Senen","Senen, Jakarta Pusat",4,3,2,202 m²,350 m²,"Rp 5,48 Miliar"
1716901784-3370,https://www.rumah123.com/jual/jakarta-pusat/rumah/?sort=posted-desc&page=882,Hot Sale Rumah di Cempaka Putih Jakarta Pusat,"Cempaka Putih, Jakarta Pusat",5,3,1,340 m²,270 m²,"Rp 6,6 Miliar"
1716901784-3371,https://www.rumah123.com/jual/jakarta-pusat/rumah/?sort=posted-desc&page=882,"Rumah baru di Kemayoran
Jakpus SHM Bagus hanya 1Man","Kemayoran, Jakarta Pusat",3,2,1,84 m²,160 m²,"Rp 1,75 Miliar"
1716901784-3372,https://www.rumah123.com/jual/jakarta-pusat/rumah/?sort=posted-desc&page=882,Rumah mewah menteng,"Menteng, Jakarta Pusat",9,7,4,925 m²,1585 m²,Rp 70 Miliar
1716901784-3373,https://www.rumah123.com/jual/jakarta-pusat/rumah/?sort=posted-desc&page=882,4 Rumah Mewah Baru dalam 1 Kavling di Menteng,"Menteng, Jakarta Pusat",3,3,8,800 m²,480 m²,Rp 132 Miliar
1716901784-3374,https://www.rumah123.com/jual/jakarta-pusat/rumah/?sort=posted-desc&page=882,"Lokasi cuan, pinggir jalan raya, pas buat usaha dan kantor","Menteng, Jakarta Pusat",3,4,6,688 m²,350 m²,Rp 28 Miliar
1716901784-3375,https://www.rumah123.com/jual/jakarta-pusat/rumah/?sort=posted-desc&page=882,Rumah Tua di pasar baru Jakarta pusat,"Pasar Baru, Jakarta Pusat",3,3,1,303 m²,371 m²,Rp 14 Miliar
1716901784-3376,https://www.rumah123.com/jual/jakarta-pusat/rumah/?sort=posted-desc&page=882,"Rumah Murah 1 Lt di Jalan Kebon Kacang,tanah Abang, Jakarta Pusat","Kebon Kacang, Jakarta Pusat",3,2,,348 m²,129 m²,"Rp 9,5 Miliar"
1716901784-3377,https://www.rumah123.com/jual/jakarta-pusat/rumah/?sort=posted-desc&page=882,Rumah M Yamin Semi Furnished Menteng Sudah Renovasi,"Menteng, Jakarta Pusat",3,5,11,707 m²,784 m²,Rp 45 Miliar
1716901784-3378,https://www.rumah123.com/jual/jakarta-pusat/rumah/?sort=posted-desc&page=882,TURUN HARGA rumah Lokasi Premium Jalan Lebar Di Menteng,"Menteng, Jakarta Pusat",3,3,3,492 m²,450 m²,Rp 40 Miliar
1716901784-3379,https://www.rumah123.com/jual/jakarta-pusat/rumah/?sort=posted-desc&page=882,Rumah tua menteng jakarta pusat SHM,"Menteng, Jakarta Pusat",7,2,1,716 m²,404 m²,Rp 49 Miliar
1716901784-3380,https://www.rumah123.com/jual/jakarta-pusat/rumah/?sort=posted-desc&page=882,Dijual Rumah di Menteng Jakpus Lt 500m Lb 700m 4 Kt,"Menteng, Jakarta Pusat",4,,,500 m²,700 m²,Rp 50 Miliar
1716901793-3381,https://www.rumah123.com/jual/jakarta-pusat/rumah/?sort=posted-desc&page=881,"Rumah SHM di Kramat Sentiong, Jakarta Pusat","Senen, Jakarta Pusat",,,,150 m²,,"Rp 2,5 Miliar"
1716901793-3382,https://www.rumah123.com/jual/jakarta-pusat/rumah/?sort=posted-desc&page=881,Dijual Rumah Murah Tua Hitung Tanah di Johar Baru,"Johar Baru, Jakarta Pusat",,,,150 m²,,"Rp 2,1 Miliar"
1716901793-3383,https://www.rumah123.com/jual/jakarta-pusat/rumah/?sort=posted-desc&page=881,Rumah di Salemba Jakarta Pusat sangat strategis SHM Bagus,"Salemba, Jakarta Pusat",,,,620 m²,,"Rp 28,5 Miliar"
1716901793-3384,https://www.rumah123.com/jual/jakarta-pusat/rumah/?sort=posted-desc&page=881,RUMAH MURAH PUSAT JAKARTA,"Kemayoran, Jakarta Pusat",3,1,,32 m²,75 m²,Rp 625 Juta
1716901793-3385,https://www.rumah123.com/jual/jakarta-pusat/rumah/?sort=posted-desc&page=881,Rumah di Petojo,"Petojo, Jakarta Pusat",5,2,,130 m²,155 m²,"Rp 3,5 Miliar"
1716901793-3386,https://www.rumah123.com/jual/jakarta-pusat/rumah/?sort=posted-desc&page=881,Rumah Mewah di Penjernihan Tanah abang Jakarta Selatan,"Tanah Abang, Jakarta Pusat",8,4,1,520 m²,650 m²,Rp 17 Miliar
1716901793-3387,https://www.rumah123.com/jual/jakarta-pusat/rumah/?sort=posted-desc&page=881,Rumah Tua Hadap Jalan Raya Menteng SHM Strategis Bagus,"Menteng, Jakarta Pusat",5,5,,692 m²,692 m²,Rp 55 Miliar
1716901793-3388,https://www.rumah123.com/jual/jakarta-pusat/rumah/?sort=posted-desc&page=881,"Rumah Hoek Luas Strategis di Kawasan Roxy, Jakarta Pusat","Gambir, Jakarta Pusat",6,1,,407 m²,211 m²,Rp 18 Miliar
1716901793-3389,https://www.rumah123.com/jual/jakarta-pusat/rumah/?sort=posted-desc&page=881,"Rumah Murah di Jl Nilam, Sumur Batu, Kemayoran. Dkt ke Kelapa Gading","Kemayoran, Jakarta Pusat",10,10,2,666 m²,600 m²,"Rp 7,85 Miliar"
1716901793-3390,https://www.rumah123.com/jual/jakarta-pusat/rumah/?sort=posted-desc&page=881,"Rumah mewah furnish n private pool di cempaka putih, jakarta","Cempaka Putih, Jakarta Pusat",4,4,6,580 m²,600 m²,Rp 16 Miliar
1716901793-3391,https://www.rumah123.com/jual/jakarta-pusat/rumah/?sort=posted-desc&page=881,Jual Cepat Rumah Super Luas di Jakarta Pusat,"Hasyim Ashari, Jakarta Pusat",5,3,3,956 m²,483 m²,Rp 80 Miliar
1716901793-3392,https://www.rumah123.com/jual/jakarta-pusat/rumah/?sort=posted-desc&page=881,Rumah modern klasik Swimming pool Cempaka putih Jakarta Pusat,"Cempaka Putih, Jakarta Pusat",4,4,6,580 m²,600 m²,Rp 16 Miliar
1716901793-3393,https://www.rumah123.com/jual/jakarta-pusat/rumah/?sort=posted-desc&page=881,"Rumah Jl Kramat Pulo, Senen, Central Jakarta City, Jakarta, 013","Senen, Jakarta Pusat",1,1,,418 m²,418 m²,"Rp 8,36 Miliar"
1716901793-3394,https://www.rumah123.com/jual/jakarta-pusat/rumah/?sort=posted-desc&page=881,RUMAH SUDAH RENOV. SIAP HUNI 2 LANTAI,"Kartini, Jakarta Pusat",2,4,,96 m²,192 m²,"Rp 2,1 Miliar"
1716901793-3395,https://www.rumah123.com/jual/jakarta-pusat/rumah/?sort=posted-desc&page=881,Dijual Rumah 2 Lt Hoek jl Semboja Petojo Jakarta Pusat,"Petojo, Jakarta Pusat",18,5,5,680 m²,1200 m²,Rp 35 Miliar
1716901793-3396,https://www.rumah123.com/jual/jakarta-pusat/rumah/?sort=posted-desc&page=881,Dijual Murah Rumah Di Cempaka Putih Jakarta Pusat Dengan Kolam Renang Bagus Terawat Siap Huni Bebas Banjir Strategis,"Cempaka Putih, Jakarta Pusat",7,7,7,580 m²,600 m²,"Rp 15,7 Miliar"
1716901793-3397,https://www.rumah123.com/jual/jakarta-pusat/rumah/?sort=posted-desc&page=881,Rumah 2 Lantai Jual Cepat Harga Murah di Rawasari Jakarta Pusat,"Cempaka Putih, Jakarta Pusat",2,1,,50 m²,100 m²,"Rp 1,25 Miliar"
1716901793-3398,https://www.rumah123.com/jual/jakarta-pusat/rumah/?sort=posted-desc&page=881,Dijual Cepat Rumah Di Cideng Lokasi Strategis,"Cideng, Jakarta Pusat",,,,350 m²,,Rp 7 Miliar
1716901793-3399,https://www.rumah123.com/jual/jakarta-pusat/rumah/?sort=posted-desc&page=881,SALE Luxury House Full Furnished Dengan Balkon Di Menteng ME025,"Menteng, Jakarta Pusat",6,6,2,700 m²,1200 m²,Rp 60 Miliar
1716901793-3400,https://www.rumah123.com/jual/jakarta-pusat/rumah/?sort=posted-desc&page=881,Cepat Rumah strategis dengan 2 akses Jl HOS Cokroaminoto dan Jl DR Kusuma Atmaja di Menteng,"Menteng, Jakarta Pusat",24,24,,1663 m²,,Rp 150 Miliar
1716901820-3401,https://www.rumah123.com/jual/jakarta-pusat/rumah/?sort=posted-desc&page=880,Rumah Tua Dekat jalan utama Di Tanah Abang Jakarta Pusat S6174,"Tanah Abang, Jakarta Pusat",4,3,6,2000 m²,600 m²,Rp 80 Miliar
1716901820-3402,https://www.rumah123.com/jual/jakarta-pusat/rumah/?sort=posted-desc&page=880,TURUN HARGA BAGUS BANGET Rumah Menteng Ada Swimming Pool dan Taman  Hub: 0817 0120 620,"Menteng, Jakarta Pusat",8,7,5,925 m²,1170 m²,Rp 65 Miliar
1716901820-3403,https://www.rumah123.com/jual/jakarta-pusat/rumah/?sort=posted-desc&page=880,MURAH Rumah Tua 915M2 Kawasan Menteng Hub: 0817 0120 620,"Menteng, Jakarta Pusat",5,5,3,915 m²,680 m²,Rp 45 Miliar
1716901820-3404,https://www.rumah123.com/jual/jakarta-pusat/rumah/?sort=posted-desc&page=880,Rumah Lebar 10 Di Cideng Dekat ITC Roxy Mas,"Cideng, Jakarta Pusat",1,1,,150 m²,110 m²,Rp 5 Miliar
1716901820-3405,https://www.rumah123.com/jual/jakarta-pusat/rumah/?sort=posted-desc&page=880,Rumah Mewah di Menteng 2 Lantai Semi Basement,"Menteng, Jakarta Pusat",5,4,4,745 m²,803 m²,Rp 75 Miliar
1716901820-3406,https://www.rumah123.com/jual/jakarta-pusat/rumah/?sort=posted-desc&page=880,Rumah Cantik Cempaka Putih Bangunan Baru Siap Huni Di Jakarta Pusat,"Cempaka Putih, Jakarta Pusat",5,5,2,180 m²,280 m²,"Rp 7,2 Miliar"
1716901820-3407,https://www.rumah123.com/jual/jakarta-pusat/rumah/?sort=posted-desc&page=880,"Rumah Terbesar di Komplek Elit Cempaka Putih, Jakarta Pusat 317m2","Cempaka Putih, Jakarta Pusat",7,4,1,317 m²,200 m²,Rp 7 Miliar
1716901820-3408,https://www.rumah123.com/jual/jakarta-pusat/rumah/?sort=posted-desc&page=880,For Sale Rumah di Menteng Suwiryo HGB,"Menteng, Jakarta Pusat",4,4,3,728 m²,300 m²,Rp 60 Miliar
1716901820-3409,https://www.rumah123.com/jual/jakarta-pusat/rumah/?sort=posted-desc&page=880,"Rumah Kost Pasar Baru 4 Lantai, 26 Kamar Termurah!","Pasar Baru, Jakarta Pusat",26,26,2,207 m²,828 m²,"Rp 7,2 Miliar"
1716901820-3410,https://www.rumah123.com/jual/jakarta-pusat/rumah/?sort=posted-desc&page=880,Golf Residence Kemayoran,"Kemayoran, Jakarta Pusat",4,3,1,200 m²,285 m²,Rp 10 Miliar
1716901820-3411,https://www.rumah123.com/jual/jakarta-pusat/rumah/?sort=posted-desc&page=880,"Rumah kantor di Menteng Area, Dijual","Menteng, Jakarta Pusat",,,,1012 m²,,Rp 57 Miliar
1716901820-3412,https://www.rumah123.com/jual/jakarta-pusat/rumah/?sort=posted-desc&page=880,"Rumah Bagus Di Jl Pengairan, Bendungan Hilir Jakarta","Bendungan Hilir, Jakarta Pusat",3,3,,126 m²,185 m²,"Rp 6,5 Miliar"
1716901820-3413,https://www.rumah123.com/jual/jakarta-pusat/rumah/?sort=posted-desc&page=880,"Jual Lewat Lelang Rumah Area Istimewa Jl. Diponegoro, Menteng","Menteng, Jakarta Pusat",5,5,8,1626 m²,700 m²,Rp 143 Miliar
1716901820-3414,https://www.rumah123.com/jual/jakarta-pusat/rumah/?sort=posted-desc&page=880,Rumah Siap Huni di Menteng Dengan Lokasi Terbaik,"Menteng, Jakarta Pusat",,,,150 m²,,Rp 5 Miliar
1716901820-3415,https://www.rumah123.com/jual/jakarta-pusat/rumah/?sort=posted-desc&page=880,"Jual Rumah di Petojo, Jakarta Pusat, R R","Petojo, Jakarta Pusat",4,2,,160 m²,120 m²,Rp 4 Miliar
1716901820-3416,https://www.rumah123.com/jual/jakarta-pusat/rumah/?sort=posted-desc&page=880,"Rumah Rapi dan Terawat, Lokasi Bagus di Jakarta Pusat","Kramat, Jakarta Pusat",4,4,,200 m²,350 m²,"Rp 5,5 Miliar"
1716901820-3417,https://www.rumah123.com/jual/jakarta-pusat/rumah/?sort=posted-desc&page=880,Dijual Rumah 2 Pintu Depan Belakang Tembus di Gunung Sahari,"Gunung Sahari, Jakarta Pusat",7,4,7,650 m²,10 m²,Rp 9 Miliar
1716901820-3418,https://www.rumah123.com/jual/jakarta-pusat/rumah/?sort=posted-desc&page=880,"Rumah 2 Lantai Bagus Furnished SHM di Menteng, Jakarta Pusat","Menteng, Jakarta Pusat",4,5,2,486 m²,416 m²,Rp 20 Miliar
1716901820-3419,https://www.rumah123.com/jual/jakarta-pusat/rumah/?sort=posted-desc&page=880,Rumah 3 Lantai Bagus Furnished Springhill Townhouse Kemayoran,"Kemayoran, Jakarta Pusat",3,3,,119 m²,250 m²,"Rp 5,5 Miliar"
1716901820-3420,https://www.rumah123.com/jual/jakarta-pusat/rumah/?sort=posted-desc&page=880,Rumah Di Pegangsaan Menteng Jakarta Pusat,"Menteng, Jakarta Pusat",4,5,,486 m²,416 m²,"Rp 15,5 Miliar"
1716901842-3421,https://www.rumah123.com/jual/jakarta-pusat/rumah/?sort=posted-desc&page=879,"Dijual Rumah tua hitung tanah jl kemayoran barat Jakarta Pusat di Jl Kemayoran Barat raya, Jakarta Pusat","Kemayoran, Jakarta Pusat",2,1,2,84 m²,76 m²,"Rp 1,48 Miliar"
1716901842-3422,https://www.rumah123.com/jual/jakarta-pusat/rumah/?sort=posted-desc&page=879,"Rumah di Jual dan Sewakan, Dengan Garasi 5 Mobil Daerah Menteng","Menteng, Jakarta Pusat",,,,536 m²,,"Rp 57,6 Miliar"
1716901842-3423,https://www.rumah123.com/jual/jakarta-pusat/rumah/?sort=posted-desc&page=879,Rumah dan Tempat Usaha di Palmerah Utara Jakarta Barat,"Tanah Abang, Jakarta Pusat",5,3,4,800 m²,500 m²,"Rp 21,6 Miliar"
1716901842-3424,https://www.rumah123.com/jual/jakarta-pusat/rumah/?sort=posted-desc&page=879,Rumah Bagus 3 lantai hadap timur laut di Pernjernihan Jakarta Pusat,"Tanah Abang, Jakarta Pusat",11,5,1,520 m²,620 m²,Rp 17 Miliar
1716901842-3425,https://www.rumah123.com/jual/jakarta-pusat/rumah/?sort=posted-desc&page=879,"Dijual Rumah Baru 3 Lt. Kp. Rawa Selatan, Johar Baru  Jakarta Pusat","Johar Baru, Jakarta Pusat",3,2,2,86 m²,200 m²,"Rp 2,75 Miliar"
1716901842-3426,https://www.rumah123.com/jual/jakarta-pusat/rumah/?sort=posted-desc&page=879,Rumah Di Jalan Irian Menteng Jakarta Pusat,"Menteng, Jakarta Pusat",7,2,4,595 m²,564 m²,Rp 42 Miliar
1716901842-3427,https://www.rumah123.com/jual/jakarta-pusat/rumah/?sort=posted-desc&page=879,SALE Rumah Kost An Aktif Di Pinggir Jalan Raya Utama Dijual ME888,"Senen, Jakarta Pusat",8,4,1,289 m²,174 m²,"Rp 13,5 Miliar"
1716901842-3428,https://www.rumah123.com/jual/jakarta-pusat/rumah/?sort=posted-desc&page=879,Rumah di Rajawali Selatan jakarta pusat,"Gunung Sahari, Jakarta Pusat",6,3,1,480 m²,249 m²,"Rp 10,5 Miliar"
1716901842-3429,https://www.rumah123.com/jual/jakarta-pusat/rumah/?sort=posted-desc&page=879,Rumah Bebas Banjir Pal Putih Jakarta Pusat,"Cempaka Putih, Jakarta Pusat",,,,221 m²,,"Rp 6,5 Miliar"
1716901842-3430,https://www.rumah123.com/jual/jakarta-pusat/rumah/?sort=posted-desc&page=879,"RUMAH BARU ON PROGRESS LEBAR 7 M DI CIDENG, JAKARTA PUSAT","Cideng, Jakarta Pusat",3,3,,70 m²,200 m²,"Rp 5,5 Miliar"
1716901842-3431,https://www.rumah123.com/jual/jakarta-pusat/rumah/?sort=posted-desc&page=879,Dijual cepat rumah di petojo selatan,"Petojo, Jakarta Pusat",3,2,,187 m²,250 m²,Rp 6 Miliar
1716901842-3432,https://www.rumah123.com/jual/jakarta-pusat/rumah/?sort=posted-desc&page=879,"Rumah Jl Lombok,menteng,lokasi Sangat Strategis Dekat Jl Mh Thamrin,sarinah Jl Agus Salim,jakarta Pusat","Menteng, Jakarta Pusat",5,4,2,492 m²,400 m²,Rp 42 Miliar
1716901842-3433,https://www.rumah123.com/jual/jakarta-pusat/rumah/?sort=posted-desc&page=879,Rumah SHM di Jalan Cikini V dekat ke lokasi Elit Menteng,"Cikini, Jakarta Pusat",3,3,2,517 m²,353 m²,"Rp 26,5 Miliar"
1716901842-3434,https://www.rumah123.com/jual/jakarta-pusat/rumah/?sort=posted-desc&page=879,Rumah Jl Jambu Menteng Jakarta PUsat,"Menteng, Jakarta Pusat",7,5,,1046 m²,560 m²,Rp 150 Miliar
1716901842-3435,https://www.rumah123.com/jual/jakarta-pusat/rumah/?sort=posted-desc&page=879,Rumah Kos2an 2 Lantai Di Cempaka Putih Jakarta Pusat,"Cempaka Putih, Jakarta Pusat",7,5,,191 m²,150 m²,"Rp 9,5 Miliar"
1716901842-3436,https://www.rumah123.com/jual/jakarta-pusat/rumah/?sort=posted-desc&page=879,Dijual Rumah Mewah Klasik Di Perumahan Elite Menteng,"Menteng, Jakarta Pusat",4,4,6,1046 m²,8001999 m²,Rp 125 Miliar
1716901842-3437,https://www.rumah123.com/jual/jakarta-pusat/rumah/?sort=posted-desc&page=879,Rumah di Petojo SHM Butuh Renovasi Hitung tanah saja,"Petojo, Jakarta Pusat",,,,100 m²,,"Rp 2,4 Miliar"
1716901842-3438,https://www.rumah123.com/jual/jakarta-pusat/rumah/?sort=posted-desc&page=879,"Rumah Mewah Dijual di Cempaka Putih, Dalam Komplek Elit, Tenang, Asri, Bebas Banjir","Cempaka Putih, Jakarta Pusat",4,4,2,297 m²,412 m²,Rp 13 Miliar
1716901842-3439,https://www.rumah123.com/jual/jakarta-pusat/rumah/?sort=posted-desc&page=879,Rumah Lokasi Strategis berada ditengah kota Jakarta Pusat @Pejompongan,"Pejompongan, Jakarta Pusat",8,4,1,520 m²,650 m²,"Rp 16,5 Miliar"
1716901842-3440,https://www.rumah123.com/jual/jakarta-pusat/rumah/?sort=posted-desc&page=879,"Rumah Dijual di Cempaka Putih, Brand New, American Classic, Dalam Komplek","Cempaka Putih, Jakarta Pusat",4,4,1,172 m²,310 m²,"Rp 6,75 Miliar"
1716901866-3441,https://www.rumah123.com/jual/jakarta-pusat/rumah/?sort=posted-desc&page=878,Rumah Di Menteng Suasana Nyaman,"Menteng, Jakarta Pusat",5,5,2,312 m²,400 m²,Rp 20 Miliar
1716901866-3442,https://www.rumah123.com/jual/jakarta-pusat/rumah/?sort=posted-desc&page=878,"Cepat 1 Unit Rumah Di Cempaka Putih, Jakarta Pusat","Cempaka Putih, Jakarta Pusat",9,5,3,720 m²,500 m²,Rp 32 Miliar
1716901866-3443,https://www.rumah123.com/jual/jakarta-pusat/rumah/?sort=posted-desc&page=878,Dijual Rumah Di Perumahan Kartini Jakarta Pusat,"Kartini, Jakarta Pusat",3,3,,74 m²,155 m²,"Rp 1,95 Miliar"
1716901866-3444,https://www.rumah123.com/jual/jakarta-pusat/rumah/?sort=posted-desc&page=878,B00716 Li Rumah Second Semi Furnish di Petojo,"Petojo, Jakarta Pusat",,,,150 m²,,"Rp 2,5 Miliar"
1716901866-3445,https://www.rumah123.com/jual/jakarta-pusat/rumah/?sort=posted-desc&page=878,Rumah 2 Lantai di Menteng Lokasi Strategis Area Perumahan,"Menteng, Jakarta Pusat",12,4,2,827 m²,619 m²,Rp 39 Miliar
1716901866-3446,https://www.rumah123.com/jual/jakarta-pusat/rumah/?sort=posted-desc&page=878,NEGO SAMPAI DEAL RUMAJ 10 X 20 FURNISH DI CIDENG JAKARTA PUSAT,"Cideng, Jakarta Pusat",4,4,2,200 m²,550 m²,Rp 7 Miliar
1716901866-3447,https://www.rumah123.com/jual/jakarta-pusat/rumah/?sort=posted-desc&page=878,SALE Rumah Menteng Mewah Asri Dengan Basement Dijual ME007,"Menteng, Jakarta Pusat",4,4,3,265 m²,5506 m²,"Rp 28,5 Miliar"
1716901866-3448,https://www.rumah123.com/jual/jakarta-pusat/rumah/?sort=posted-desc&page=878,Rumah di Jl.Syamsu Rizal 2 Lantai Bagus SHM,"Menteng, Jakarta Pusat",5,4,2,519 m²,470 m²,"Rp 42,9 Miliar"
1716901866-3449,https://www.rumah123.com/jual/jakarta-pusat/rumah/?sort=posted-desc&page=878,"Rumah 2 Lantai Bagus Semi Furnished di Menteng, Jakarta Pusat","Menteng, Jakarta Pusat",5,5,4,720 m²,550 m²,"Rp 69,9 Miliar"
1716901866-3450,https://www.rumah123.com/jual/jakarta-pusat/rumah/?sort=posted-desc&page=878,Rumah di Menteng Jakarta Pusat,"Menteng, Jakarta Pusat",3,4,1,156 m²,288 m²,Rp 17 Miliar
1716901866-3451,https://www.rumah123.com/jual/jakarta-pusat/rumah/?sort=posted-desc&page=878,B00697 Yn Rumah Second Wilayah Senen,"Senen, Jakarta Pusat",,,,282 m²,,"Rp 18,5 Miliar"
1716901866-3452,https://www.rumah123.com/jual/jakarta-pusat/rumah/?sort=posted-desc&page=878,Rumah di Cikini SHM Murah,"Menteng, Jakarta Pusat",4,4,2,568 m²,268 m²,Rp 20 Miliar
